"prot"	"HighTemp_A"	"HighTemp_B"	"HighTemp_C"	"LowpH_A"	"LowpH_B"	"LowpH_C"	"LowpH_D"	"standard_A"	"standard_B"	"standard_C"	"standard_D"	"Top.Protein.Description"	"Chassy_ID"	"W29_NCBI"	"CLIB122_NCBI"	"CLIB122_UNIPROT"	"Protein_name"	"ec_number"
"c968.a1.a1"	2.58879343171355	8.68999477857325	10.8758257464062	8.66683989675222	11.6981639609113	3.54005235182533	8.40386502102448	2.27146433030117	NA	2.31784109450508	9.90191913720916	"Chassy_YL_D_447;YALI1_D11442g;YALI0D08976g1_1;Q6C9R4;similar to uniprot|Q12377 Saccharomyces cerevisiae YDL097c RPN6 subunit of the regulatory particle of the proteasome"	"Chassy_YL_D_447"	"YALI1_D11442g"	"YALI0D08976g1_1"	"Q6C9R4"	"similar to uniprot|Q12377 Saccharomyces cerevisiae YDL097c RPN6 subunit of the regulatory particle of the proteasome"	""
"c969.a1.a1"	14.3409195319368	22.2200682762846	20.3871842301902	26.6834764612697	17.5506693853884	16.0939604058436	6.34958852018224	32.8430122544371	2.47552267390445	6.37810665399659	19.1901295535683	"Chassy_YL_E_120;YALI1_E03067g;YALI0E02420g1_1;Q6C7A3;weakly similar to uniprot|P40557 Saccharomyces cerevisiae YIL005w related to protein disulfide isomerases"	"Chassy_YL_E_120"	"YALI1_E03067g"	"YALI0E02420g1_1"	"Q6C7A3"	"weakly similar to uniprot|P40557 Saccharomyces cerevisiae YIL005w related to protein disulfide isomerases"	""
"c970.a1.a1"	6.46935665058411	27.3704327015751	65.5088687880215	5.56240907445503	9.11046153069785	7.59936855751816	17.6528536414683	8.86652445087347	NA	48.9392147275244	10.6521375213461	"Chassy_YL_D_884;YALI1_D22691g;YALI0D18139g1_1;No Uniprot ID;weakly similar to uniprot|E9EMM9 Metarhizium anisopliae hypothetical protein MAA_01122"	"Chassy_YL_D_884"	"YALI1_D22691g"	"YALI0D18139g1_1"	""	"weakly similar to uniprot|E9EMM9 Metarhizium anisopliae hypothetical protein MAA_01122"	""
"c971.a1.a1"	79.9885747917178	43.4149856725126	18.0826991361643	54.8412096615311	147.081586496274	116.57330153539	47.6005042198273	84.1446075990167	6.36169229443971	15.9669063453514	105.451570006062	"Chassy_YL_E_921;YALI1_E23292g;YALI0E19448g1_1;Q6C5B6;weakly similar to uniprot|P40553 Saccharomyces cerevisiae YIL010W DOT5 Nuclear thiol peroxidase, Disrupter of telomere silencing protein"	"Chassy_YL_E_921"	"YALI1_E23292g"	"YALI0E19448g1_1"	"Q6C5B6"	"weakly similar to uniprot|P40553 Saccharomyces cerevisiae YIL010W DOT5 Nuclear thiol peroxidase, Disrupter of telomere silencing protein"	""
"c972.a1.a1"	5.34418334723068	12.6182137782261	5.42783442640613	10.2598834019586	2.13852594397211	9.81984935602514	12.3550502706315	6.84195934248755	NA	13.7254328464911	1.27560315530209	"Chassy_YL_D_406;YALI1_D10495g;YALI0D08206g1_1;Q6C9U9;similar to uniprot|Q08108 Saccharomyces cerevisiae YOL011W (ohnolog of YMR008C) PLB3 phospholipase B (lysophospholipase)"	"Chassy_YL_D_406"	"YALI1_D10495g"	"YALI0D08206g1_1"	"Q6C9U9"	"similar to uniprot|Q08108 Saccharomyces cerevisiae YOL011W (ohnolog of YMR008C) PLB3 phospholipase B (lysophospholipase)"	"3.1.1.5"
"c973.a1.a1"	41.0551671221945	34.2321638823077	26.7438430971664	24.131928426108	2.7498771446002	2.36972856400481	9.6459131156595	47.5038969872119	19.3554399432665	32.3690280456652	22.9033672784925	"Chassy_YL_D_575;YALI1_D14489g;W29 specific;Q6C9F3;No description in CLIB122"	"Chassy_YL_D_575"	"YALI1_D14489g"	""	"Q6C9F3"	"No description in CLIB122"	""
"c974.a1.a1"	28.7003568826962	79.0949990159664	45.3404267920742	27.2014175779256	26.7656163688174	27.5157425731503	29.462526247106	36.9581687487872	8.02450262441351	89.5933782502418	34.3179213480812	"Chassy_YL_F_763;YALI1_F19478g;YALI0F14575g1_1;Q6C1P3;similar to uniprot|P32337 Saccharomyces cerevisiae YMR308c PSE1 beta karyopherin"	"Chassy_YL_F_763"	"YALI1_F19478g"	"YALI0F14575g1_1"	"Q6C1P3"	"similar to uniprot|P32337 Saccharomyces cerevisiae YMR308c PSE1 beta karyopherin"	""
"c975.a1.a1"	69.8133183763932	154.32175143494	136.684603215247	99.9927218002365	36.5451091755233	51.5743787324079	91.2231411661556	69.189730171987	NA	148.940936031511	92.8902772600542	"Chassy_YL_B_689;YALI1_B18384g;YALI0B13882g1_1;Q6CEQ4;similar to uniprot|P39704 Saccharomyces cerevisiae YAL007C (ohnolog of YOR016C) ERP2 p24 protein involved in membrane trafficking"	"Chassy_YL_B_689"	"YALI1_B18384g"	"YALI0B13882g1_1"	"Q6CEQ4"	"similar to uniprot|P39704 Saccharomyces cerevisiae YAL007C (ohnolog of YOR016C) ERP2 p24 protein involved in membrane trafficking"	""
"c976.a1.a1"	83.8271326591638	141.736198771281	178.14808980353	114.512810143623	130.061678918729	113.517633683648	147.019489843137	185.745533789067	38.2429972940973	198.319893764407	130.049408462291	"Chassy_YL_C_663;YALI1_C18258g;YALI0C13090g1_1;Q6CC28;uniprot|Q6CC28 Yarrowia lipolytica YALI0C13090g GAL1 Galactokinase, putative"	"Chassy_YL_C_663"	"YALI1_C18258g"	"YALI0C13090g1_1"	"Q6CC28"	"uniprot|Q6CC28 Yarrowia lipolytica YALI0C13090g GAL1 Galactokinase, putative"	""
"c977.a1.a1"	7.2040166287401	12.8079038441734	6.03144953113529	4.10986216471345	NA	0.972176989432704	NA	7.51421491888577	NA	5.32274685612076	7.47480394174842	"Chassy_YL_C_795;YALI1_C21682g;YALI0C15356g1_1;Q6CBU7;uniprot|Q6CBU7 Yarrowia lipolytica YALI0C15356g PEX1 Peroxisomal biogenesis factor 1 (Peroxin-1), ATPase of the AAA family"	"Chassy_YL_C_795"	"YALI1_C21682g"	"YALI0C15356g1_1"	"Q6CBU7"	"uniprot|Q6CBU7 Yarrowia lipolytica YALI0C15356g PEX1 Peroxisomal biogenesis factor 1 (Peroxin-1), ATPase of the AAA family"	""
"c978.a1.a1"	17.9947240752184	27.1833001186163	33.019841654684	NA	8.03390424045321	6.16701452697992	22.5525933157426	27.340962006833	NA	31.5878414175236	24.1490408455928	"Chassy_YL_E_1672;YALI1_E41399g;YALI0E34852g1_1;Q6C3H2;similar to uniprot|P32803 Saccharomyces cerevisiae YGL200c EMP24 component of the COPII-coated vesicles"	"Chassy_YL_E_1672"	"YALI1_E41399g"	"YALI0E34852g1_1"	"Q6C3H2"	"similar to uniprot|P32803 Saccharomyces cerevisiae YGL200c EMP24 component of the COPII-coated vesicles"	""
"c979.a1.a1"	41.0916658802968	62.3132737365771	39.3701566408569	32.0957990559667	23.1217949850441	42.4818833266247	30.7025745629351	43.6743237874401	5.15306439949396	43.9411963191134	54.7746217890648	"Chassy_YL_A_387;YALI1_A09593g;YALI0A09812g1_1;Q6CHE2;similar to uniprot|Q04371 Saccharomyces cerevisiae YMR027w HRT2 high level expression reduced Ty3 transposition"	"Chassy_YL_A_387"	"YALI1_A09593g"	"YALI0A09812g1_1"	"Q6CHE2"	"similar to uniprot|Q04371 Saccharomyces cerevisiae YMR027w HRT2 high level expression reduced Ty3 transposition"	""
"c980.a1.a1"	56.6148284006548	125.600382650665	113.912902714904	73.8589945396934	57.2963761054487	40.8449756593865	59.9781522033825	61.0298306313054	13.1754944619832	66.9215470639438	80.6021883698811	"Chassy_YL_A_776;YALI1_A19483g;YALI0A18612g1_1;Q6CGK2;similar to uniprot|P32496 Saccharomyces cerevisiae YFR052w NIN1 26S proteasome regulatory subunit"	"Chassy_YL_A_776"	"YALI1_A19483g"	"YALI0A18612g1_1"	"Q6CGK2"	"similar to uniprot|P32496 Saccharomyces cerevisiae YFR052w NIN1 26S proteasome regulatory subunit"	""
"c981.a1.a1"	45.5819177700419	96.6174914605187	52.2070155600441	97.7891759536111	134.659942523587	127.329928736907	110.964998494718	61.3697587514484	9.92485901590891	71.4379833111874	59.1822663241959	"Chassy_YL_C_450;YALI1_C12941g;YALI0C09284g1_1;Q6CCH6;uniprot|Q6CCH6 Yarrowia lipolytica YALI0C09284g FAT4 Peroxisomal protein that binds AMP and mRNA, putative"	"Chassy_YL_C_450"	"YALI1_C12941g"	"YALI0C09284g1_1"	"Q6CCH6"	"uniprot|Q6CCH6 Yarrowia lipolytica YALI0C09284g FAT4 Peroxisomal protein that binds AMP and mRNA, putative"	""
"c982.a1.a1"	51.0072723167024	62.9910773067166	90.7897389531746	47.4507366527374	39.1795893107537	29.7335263875762	28.813377741153	24.3582371115678	NA	25.332457521458	37.178571269322	"Chassy_YL_B_484;YALI1_B12691g;YALI0B09471g1_1;Q6CF81;similar to uniprot|O60121 Schizosaccharomyces pombe Stomatin family protein"	"Chassy_YL_B_484"	"YALI1_B12691g"	"YALI0B09471g1_1"	"Q6CF81"	"similar to uniprot|O60121 Schizosaccharomyces pombe Stomatin family protein"	""
"c984.a1.a1"	4.59092567730734	13.2509766206596	3.51574375405783	2.27437552743339	2.28408250499224	1.83324516034207	2.4285558820758	13.6304436880828	NA	8.65691807596213	2.49941077212383	"Chassy_YL_E_130;YALI1_E03320g;YALI0E02706g1_1;Q6C792;similar to uniprot|P38181 Saccharomyces cerevisiae YBL079W (ohnolog of YER105C) NUP170 nuclear pore protein"	"Chassy_YL_E_130"	"YALI1_E03320g"	"YALI0E02706g1_1"	"Q6C792"	"similar to uniprot|P38181 Saccharomyces cerevisiae YBL079W (ohnolog of YER105C) NUP170 nuclear pore protein"	""
"c985.a1.a1"	25.7281502688331	57.2627189499737	8.27594512359658	53.8292544777465	12.5236804737563	8.8615127292063	10.0694283729783	10.6893866726971	13.7418270587174	8.34212063435753	7.27194134101407	"Chassy_YL_B_1119;YALI1_B29883g;YALI0B22924g1_1;Q6CDL9;similar to uniprot|P47119 Saccharomyces cerevisiae YJR069c HAM1 controls 6-N-hydroxylaminopurine sensitivity and mutagenesis"	"Chassy_YL_B_1119"	"YALI1_B29883g"	"YALI0B22924g1_1"	"Q6CDL9"	"similar to uniprot|P47119 Saccharomyces cerevisiae YJR069c HAM1 controls 6-N-hydroxylaminopurine sensitivity and mutagenesis"	"3.6.1.9"
"c986.a1.a1"	10.9242090823478	16.178221255347	19.5353225857061	3.02897110644361	12.4846542856617	10.0556370777826	2.61194279403252	11.9596441217542	7.89764451029208	17.788462627542	18.9241748397349	"Chassy_YL_C_844;YALI1_C23511g;W29 specific;No Uniprot ID;No description in CLIB122"	"Chassy_YL_C_844"	"YALI1_C23511g"	""	""	"No description in CLIB122"	""
"c987.a1.a1"	16.0128855728525	20.363149812705	19.2655766351836	6.42856978720566	8.70642848360857	9.17028955808663	5.80916544518448	23.4732391728322	3.90563328621331	19.0560455786694	29.3873555515399	"Chassy_YL_D_1315;YALI1_D34739g;YALI0D26279g1_1;Q6C7Q4;similar to uniprot|P39984 Saccharomyces cerevisiae YEL056w HAT2 subunit of the major yeast histone acetyltransferase"	"Chassy_YL_D_1315"	"YALI1_D34739g"	"YALI0D26279g1_1"	"Q6C7Q4"	"similar to uniprot|P39984 Saccharomyces cerevisiae YEL056w HAT2 subunit of the major yeast histone acetyltransferase"	""
"c988.a1.a1"	69.3096274117115	130.017021385106	118.396793499755	81.7820570201885	7.38563861345343	24.4241566558516	32.9474917165667	117.381790553145	14.7896359741286	118.689303780083	54.4524663639271	"Chassy_YL_A_758;YALI1_A18847g;W29 specific;No Uniprot ID;No description in CLIB122"	"Chassy_YL_A_758"	"YALI1_A18847g"	""	""	"No description in CLIB122"	""
"c989.a1.a1"	15.7177296495628	23.6566016406396	8.94693965587118	9.87407230713723	NA	2.37486142088242	8.32540177654828	7.49138411205744	NA	2.22509705481563	7.79934002666528	"Chassy_YL_F_212;YALI1_F06076g;YALI0F04059g1_1;Q6C2Y6;similar to uniprot|Q08601 Saccharomyces cerevisiae YOR197W MCA1 Metacaspase"	"Chassy_YL_F_212"	"YALI1_F06076g"	"YALI0F04059g1_1"	"Q6C2Y6"	"similar to uniprot|Q08601 Saccharomyces cerevisiae YOR197W MCA1 Metacaspase"	"3.4.22.-"
"c990.a1.a1"	NA	NA	NA	2.44295262230948	20.6522800279564	4.91193897509147	28.3277551041727	39.1320913971132	11.9847913672864	7.90827095369314	20.6524356357425	"Chassy_YL_E_112;YALI1_E02850g;YALI0E02266g1_1;Q6C7B0;similar to uniprot|D5GHJ9 Tuber melanosporum hypothetical protein"	"Chassy_YL_E_112"	"YALI1_E02850g"	"YALI0E02266g1_1"	"Q6C7B0"	"similar to uniprot|D5GHJ9 Tuber melanosporum hypothetical protein"	""
"c991.a1.a1"	133.094990895531	160.962931585897	161.545983830236	107.241069708813	112.611780776397	103.868541256034	88.6766636386827	143.226496724982	7.03223795154015	77.5498806124117	103.526652260724	"Chassy_YL_E_618;YALI1_E16068g;YALI0E13123g1_1;Q6C624;similar to uniprot|P07263 Saccharomyces cerevisiae YPR033c HTS1 histidine--tRNA ligase, mitochondrial"	"Chassy_YL_E_618"	"YALI1_E16068g"	"YALI0E13123g1_1"	"Q6C624"	"similar to uniprot|P07263 Saccharomyces cerevisiae YPR033c HTS1 histidine--tRNA ligase, mitochondrial"	""
"c992.a1.a1"	35.7567588492558	32.6356035728349	29.9551988110224	NA	4.48264521034059	NA	3.08235985062284	28.3434174760525	NA	6.82224978924286	18.5122751483645	"Chassy_YL_D_441;YALI1_D11343g;YALI0D08844g1_1;Q6C9S0;similar to uniprot|Q12068 Saccharomyces cerevisiae YOL151w GRE2"	"Chassy_YL_D_441"	"YALI1_D11343g"	"YALI0D08844g1_1"	"Q6C9S0"	"similar to uniprot|Q12068 Saccharomyces cerevisiae YOL151w GRE2"	""
"c993.a1.a1"	57.7340868080479	155.148880289821	23.9233360830853	57.1597622368504	65.9072141853828	53.3318227442263	43.8864774419643	71.6876753215089	13.5183726215553	27.830248962662	69.1105639120188	"Chassy_YL_E_264;YALI1_E06573g;YALI0E05599g1_1;Q6C6X0;similar to uniprot|Q9Y7G7 Neurospora crassa NDH64 64 kDa mitochondrial NADH dehydrogenase"	"Chassy_YL_E_264"	"YALI1_E06573g"	"YALI0E05599g1_1"	"Q6C6X0"	"similar to uniprot|Q9Y7G7 Neurospora crassa NDH64 64 kDa mitochondrial NADH dehydrogenase"	""
"c994.a1.a1"	20.5179010659714	19.0324801731949	10.1966113999777	43.4033776910918	11.986914123411	21.5237812265698	26.7792980070431	32.4946263392763	5.55574220065333	22.4954973897333	22.7264934771986	"Chassy_YL_D_821;YALI1_D21100g;YALI0D17138g1_1;Q6C8T4;similar to uniprot|Q01662 Saccharomyces cerevisiae YLR244c MAP1 methionine aminopeptidase, isoform 1"	"Chassy_YL_D_821"	"YALI1_D21100g"	"YALI0D17138g1_1"	"Q6C8T4"	"similar to uniprot|Q01662 Saccharomyces cerevisiae YLR244c MAP1 methionine aminopeptidase, isoform 1"	"3.4.11.18"
"c995.a1.a1"	14.774448361733	34.2553352279735	6.3297899943322	1.55623447807665	NA	NA	NA	47.6881667745162	3.10557910879568	52.1254321919964	46.0400068224139	"Chassy_YL_E_1666;YALI1_E41276g;YALI0E34771g1_1;Q6C3H6;weakly similar to uniprot|P22580 Saccharomyces cerevisiae YDR242w AMD2 amidase"	"Chassy_YL_E_1666"	"YALI1_E41276g"	"YALI0E34771g1_1"	"Q6C3H6"	"weakly similar to uniprot|P22580 Saccharomyces cerevisiae YDR242w AMD2 amidase"	""
"c996.a1.a1"	37.3777402997999	49.3797589381895	42.3654137908731	47.0646438905091	17.3618160467834	12.1800473068664	17.2397416451488	34.9221184593697	NA	12.0203883537703	36.5814733363861	"Chassy_YL_B_1064;YALI1_B28357g;YALI0B21692g1_1;Q6CDR9;similar to uniprot|A2RA32 Aspergillus niger short- chain dehydrogenase/reductase"	"Chassy_YL_B_1064"	"YALI1_B28357g"	"YALI0B21692g1_1"	"Q6CDR9"	"similar to uniprot|A2RA32 Aspergillus niger short- chain dehydrogenase/reductase"	""
"c997.a1.a1"	31.9076407922788	65.0948425950439	21.8464139655931	89.9653279263085	48.3436197707997	22.8633084385244	24.4468289971052	31.965018435875	NA	39.0220617915918	23.5810641458402	"Chassy_YL_E_1028;YALI1_E25675g;YALI0E21648g1_1;Q6C524;similar to uniprot|A3LYE0 Scheffersomyces stipitis PICST_48448 hypothetical protein"	"Chassy_YL_E_1028"	"YALI1_E25675g"	"YALI0E21648g1_1"	"Q6C524"	"similar to uniprot|A3LYE0 Scheffersomyces stipitis PICST_48448 hypothetical protein"	""
"c998.a1.a1"	8.72446677241403	12.3887836176943	9.72119985611597	10.2326992272425	13.021952620205	9.14601067461661	1.9744190954443	11.0162490898607	NA	2.8511690469815	3.00884704818322	"Chassy_YL_E_1150;YALI1_E28465g;YALI0E23947g1_1;Q6C4T2;similar to uniprot|P07703 Saccharomyces cerevisiae YPR110c RPC40 DNA-directed RNA polymerase I and III 40 kDa polypeptide"	"Chassy_YL_E_1150"	"YALI1_E28465g"	"YALI0E23947g1_1"	"Q6C4T2"	"similar to uniprot|P07703 Saccharomyces cerevisiae YPR110c RPC40 DNA-directed RNA polymerase I and III 40 kDa polypeptide"	""
"c999.a1.a1"	11.3188340100164	39.4916861989928	60.6298559503429	17.2127629196406	3.78547554675141	NA	5.78957446452494	27.0362144639642	5.7656688633796	46.8828254029397	36.7781690203736	"Chassy_YL_F_590;YALI1_F15418g;YALI0F11671g1_1;Q6C215;some similarities with uniprot|Q6BHA9 Debaryomyces hansenii DEHA2G19976p"	"Chassy_YL_F_590"	"YALI1_F15418g"	"YALI0F11671g1_1"	"Q6C215"	"some similarities with uniprot|Q6BHA9 Debaryomyces hansenii DEHA2G19976p"	""
"d1000.a1.a1"	30.4636822124521	13.9862369835358	46.8988659076404	12.3876725057834	13.9387206747525	15.3025339836278	NA	36.7776202638141	NA	16.5721766756859	45.2214484494015	"Chassy_YL_F_360;YALI1_F10115g;YALI0F06826g1_1;B5RSL1;similar to uniprot|Q12306 Saccharomyces cerevisiae YDR510W SMT3 Ubiquitin-like protein of the SUMO family"	"Chassy_YL_F_360"	"YALI1_F10115g"	"YALI0F06826g1_1"	"B5RSL1"	"similar to uniprot|Q12306 Saccharomyces cerevisiae YDR510W SMT3 Ubiquitin-like protein of the SUMO family"	""
"d1001.a1.a1"	43.7684408356622	100.08382469594	64.3067716965499	36.3768615138741	14.1221596924999	24.8368059491434	36.6083396300655	35.8313894204926	108.763467900379	49.6616254893664	25.2903597332264	"Chassy_YL_E_1543;YALI1_E38131g;YALI0E32164g1_1;B5FVG3;similar to uniprot|P81449 Saccharomyces cerevisiae YDR322C-A ATP21 ATP synthase e, mitochondrial"	"Chassy_YL_E_1543"	"YALI1_E38131g"	"YALI0E32164g1_1"	"B5FVG3"	"similar to uniprot|P81449 Saccharomyces cerevisiae YDR322C-A ATP21 ATP synthase e, mitochondrial"	""
"d1002.a1.a1"	6.42689783843889	8.87853398298493	8.96278277612343	3.40738858547374	1.91764369407158	1.48450190010419	1.73696989759424	5.70065194444973	9.94073530364105	7.12712281216682	6.9961951192227	"Chassy_YL_F_862;YALI1_F22321g;YALI0F16709g1_1;Q6C1F6;similar to uniprot|P11491 Saccharomyces cerevisiae YDR481c PHO8 repressible alkaline phosphatase vacuolar"	"Chassy_YL_F_862"	"YALI1_F22321g"	"YALI0F16709g1_1"	"Q6C1F6"	"similar to uniprot|P11491 Saccharomyces cerevisiae YDR481c PHO8 repressible alkaline phosphatase vacuolar"	"3.1.3.1"
"d1003.a1.a1"	26.8964878678199	35.6325347682336	27.7706683651268	21.5428070394858	10.6282144558079	11.6257819562257	10.8658990256301	22.9396196431431	NA	22.1303367164535	12.551422755932	"Chassy_YL_E_1277;YALI1_E31754g;YALI0E26829g1_1;Q6C4H2;similar to uniprot|P04397 Saccharomyces cerevisiae YBR019c GAL10 UDP-glucose 4-epimerase"	"Chassy_YL_E_1277"	"YALI1_E31754g"	"YALI0E26829g1_1"	"Q6C4H2"	"similar to uniprot|P04397 Saccharomyces cerevisiae YBR019c GAL10 UDP-glucose 4-epimerase"	""
"d1004.a1.a1"	50.8399618379114	52.8729312025836	78.1149828333197	50.5023415770498	72.1379936822347	59.9296172667206	31.6962525652223	39.2476061541891	NA	42.7418269116478	58.1276556800492	"Chassy_YL_F_851;YALI1_F21875g;YALI0F16401g1_1;Q6C1G7;weakly similar to uniprot|P22580 Saccharomyces cerevisiae YDR242w AMD2 amidase"	"Chassy_YL_F_851"	"YALI1_F21875g"	"YALI0F16401g1_1"	"Q6C1G7"	"weakly similar to uniprot|P22580 Saccharomyces cerevisiae YDR242w AMD2 amidase"	""
"d1005.a1.a1"	60.6964513228192	45.2847346226149	49.6397692400936	25.0853110097584	78.2111964408271	67.7857369085627	32.8104235254672	72.8924922386535	30.2814232959262	51.4984831943426	79.7224945645917	"NADH dehydrogenase subunit 5 (mitochondrion); NADH dehydrogenase subunit 5 (mitochondrion);W29 specific;No Uniprot ID;No description in CLIB122"	"NADH dehydrogenase subunit 5 (mitochondrion)"	"NADH dehydrogenase subunit 5 (mitochondrion)"	""	""	"NADH dehydrogenase subunit 5 (mitochondrion)"	""
"d1006.a1.a1"	31.5476355312902	45.5117418407326	19.4806191443809	9.13512778756443	11.4197251959858	11.4642921939092	11.5907773686825	33.7671550799204	NA	18.1257025404534	34.9513731301189	"Chassy_YL_F_615;YALI1_F15905g;YALI0F12067g1_1;Q6C1Z7;weakly similar to uniprot|Q7SDB1 Neurospora crassa NCU02099.1 predicted protein"	"Chassy_YL_F_615"	"YALI1_F15905g"	"YALI0F12067g1_1"	"Q6C1Z7"	"weakly similar to uniprot|Q7SDB1 Neurospora crassa NCU02099.1 predicted protein"	""
"d1007.a1.a1"	30.2572418510291	1.68964528315698	1.4360802594147	NA	NA	NA	NA	54.0296246137899	NA	9.14492422003084	58.5066710769399	"Chassy_YL_F_1405;YALI1_F35868g;YALI0F28193g1_1;Q6C031;similar to uniprot|P53322 Saccharomyces cerevisiae YGR260w TNA1 similarity to allantoate transport protein"	"Chassy_YL_F_1405"	"YALI1_F35868g"	"YALI0F28193g1_1"	"Q6C031"	"similar to uniprot|P53322 Saccharomyces cerevisiae YGR260w TNA1 similarity to allantoate transport protein"	""
"d1008.a1.a1"	20.7935284319512	20.9246407437022	11.1574297007537	12.7262362109887	10.8962120097264	11.1115308233377	12.056937685997	29.9049799927773	NA	15.3513335990417	21.3478969132143	"Chassy_YL_E_228;YALI1_E05731g;YALI0E04807g1_1;Q6C704;uniprot|Q6C704 Yarrowia lipolytica YALI0E04807g HMG1 HMG-CoA reductase, putative"	"Chassy_YL_E_228"	"YALI1_E05731g"	"YALI0E04807g1_1"	"Q6C704"	"uniprot|Q6C704 Yarrowia lipolytica YALI0E04807g HMG1 HMG-CoA reductase, putative"	"1.1.1.34"
"d1009.a1.a1"	39.0184163693977	61.4531000722324	93.0883954452787	43.6440025138576	21.8093561963969	15.8947732986953	46.1665832804509	49.9717899483206	26.643892862234	79.7542532689001	71.6005274699957	"Chassy_YL_B_406;YALI1_B10449g;W29 specific;No Uniprot ID;No description in CLIB122"	"Chassy_YL_B_406"	"YALI1_B10449g"	""	""	"No description in CLIB122"	""
"d1010.a1.a1"	88.0182007422455	14.9564885185164	2.96917721053426	18.7089049218621	89.7395892558097	93.2822288524405	24.115745465129	69.6325774586181	26.1124408785427	13.2851276337018	88.1773237522042	"Chassy_YL_E_1355;YALI1_E33760g;YALI0E28534g1_1;Q6C4A1;weakly similar to uniprot|P33890 Saccharomyces cerevisiae YOR010C (ohnolog of YIL011W) TIR2 cold shock induced protein"	"Chassy_YL_E_1355"	"YALI1_E33760g"	"YALI0E28534g1_1"	"Q6C4A1"	"weakly similar to uniprot|P33890 Saccharomyces cerevisiae YOR010C (ohnolog of YIL011W) TIR2 cold shock induced protein"	""
"d1012.a1.a1"	71.8770594882219	31.6776590303079	26.400892063037	22.7748523288562	87.6081633528867	57.5560943352566	23.9131330636937	47.9409626049384	3.81702505310662	22.3055914104901	10.5342719070615	"Chassy_YL_C_913;YALI1_C25352g;YALI0C18205g1_1;Q6CBJ6;highly similar to uniprot|P49017 Saccharomyces cerevisiae YML110c DBI56 Ubiquinone biosynthesis methyltransferase COQ5"	"Chassy_YL_C_913"	"YALI1_C25352g"	"YALI0C18205g1_1"	"Q6CBJ6"	"highly similar to uniprot|P49017 Saccharomyces cerevisiae YML110c DBI56 Ubiquinone biosynthesis methyltransferase COQ5"	"2.1.1.201"
"d1013.a1.a1"	1.07298402405845	11.425392257103	1.61151051492702	2.1862335411309	3.08994452650197	15.286802147602	7.28887444954166	3.42246214291964	NA	1.62687295051843	7.80829302342218	"Chassy_YL_D_603;YALI1_D15333g;YALI0D12320g1_1;Q6C9C4;similar to uniprot|P12687 Saccharomyces cerevisiae YNL005C MRP7 Mitochondrial ribosomal protein of the large subunit"	"Chassy_YL_D_603"	"YALI1_D15333g"	"YALI0D12320g1_1"	"Q6C9C4"	"similar to uniprot|P12687 Saccharomyces cerevisiae YNL005C MRP7 Mitochondrial ribosomal protein of the large subunit"	""
"d1014.a1.a1"	0.570592497639403	2.65087203159574	NA	0.612962068668339	0.779244554686675	0.78896162089888	0.797042235060282	0.71847720196504	NA	3.12392173692906	0.972183232328441	"Chassy_YL_B_87;YALI1_B02091g;YALI0B01224g1_1;W0TYP5;similar to uniprot|P23615 Saccharomyces cerevisiae YGR116w SPT6 transcription elongation protein singleton"	"Chassy_YL_B_87"	"YALI1_B02091g"	"YALI0B01224g1_1"	"W0TYP5"	"similar to uniprot|P23615 Saccharomyces cerevisiae YGR116w SPT6 transcription elongation protein singleton"	""
"d1015.a1.a1"	2.80857152983552	10.1694340690377	11.585875906099	4.95322623863828	0.802814504199781	3.39815020720729	5.26445108184601	7.09443243662209	NA	5.65822830672032	1.26998785155502	"Chassy_YL_B_105;YALI1_B02550g;YALI0B01628g1_1;Q6CG19;similar to uniprot|P53258 Saccharomyces cerevisiae YGR100w MIC1 MAC1P interacting protein"	"Chassy_YL_B_105"	"YALI1_B02550g"	"YALI0B01628g1_1"	"Q6CG19"	"similar to uniprot|P53258 Saccharomyces cerevisiae YGR100w MIC1 MAC1P interacting protein"	""
"d1016.a1.a1"	7.15373471968477	27.1093179603458	29.3129820935988	1.87450375042251	3.02961760231027	NA	3.32343984373974	8.27966749941002	NA	22.5797506293538	8.95594241427096	"Chassy_YL_B_740;YALI1_B19576g;YALI0B14927g1_1;Q6CEK6;similar to uniprot|P25332 Saccharomyces cerevisiae YCR036w RBK1 ribokinase"	"Chassy_YL_B_740"	"YALI1_B19576g"	"YALI0B14927g1_1"	"Q6CEK6"	"similar to uniprot|P25332 Saccharomyces cerevisiae YCR036w RBK1 ribokinase"	"2.7.1.15"
"d1017.a1.a1"	14.3557026793521	27.8491895161392	22.3328420307342	10.9377409996349	11.7212629309953	10.5929971592642	9.15001133561245	10.4709209878567	6.50532277296498	11.3619097228171	14.4651753729977	"Chassy_YL_B_1141;YALI1_B30275g;YALI0B23430g1_1;Q6CDJ6;weakly similar to uniprot|P31225 Candida albicans Corticosteroid-binding protein"	"Chassy_YL_B_1141"	"YALI1_B30275g"	"YALI0B23430g1_1"	"Q6CDJ6"	"weakly similar to uniprot|P31225 Candida albicans Corticosteroid-binding protein"	""
"d1018.a1.a1"	223.382504404702	147.564676314377	56.1606594317068	26.4392202158973	46.9520617073231	43.9694660550532	NA	332.287342378104	NA	181.10182133927	303.766526034181	"Chassy_YL_B_476;YALI1_B12409g;YALI0B09273g1_1;Q6CF88;similar to uniprot|Q99385 Saccharomyces cerevisiae YDL128w VCX1 Ca2+-transport (H+/Ca2+ exchange) protein, vacuolar"	"Chassy_YL_B_476"	"YALI1_B12409g"	"YALI0B09273g1_1"	"Q6CF88"	"similar to uniprot|Q99385 Saccharomyces cerevisiae YDL128w VCX1 Ca2+-transport (H+/Ca2+ exchange) protein, vacuolar"	""
"d1019.a1.a1"	13.8347725644128	14.6144428644925	15.4180599689255	13.460170504344	6.08998117153286	13.3946466463647	11.6747802855306	18.8523907341041	NA	6.87530633170744	24.7234633969755	"Chassy_YL_D_711;YALI1_D17854g;YALI0D14608g1_1;Q6C933;hypothetical protein conserved in the Yarrowia clade"	"Chassy_YL_D_711"	"YALI1_D17854g"	"YALI0D14608g1_1"	"Q6C933"	"hypothetical protein conserved in the Yarrowia clade"	""
"d1021.a1.a1"	2.05346877386225	8.15432064304818	6.40204480769349	3.00133123478755	4.48210740305473	4.12954406198825	8.64705569958415	2.28056600438331	NA	3.11394543259462	0.97471955830159	"Chassy_YL_D_1164;YALI1_D30324g;YALI0D23463g1_1;Q6C820;similar to uniprot|A3GHG4 Scheffersomyces stipitis SEC7 Guanine nucleotide exchange protein for ADP- robosylation factor"	"Chassy_YL_D_1164"	"YALI1_D30324g"	"YALI0D23463g1_1"	"Q6C820"	"similar to uniprot|A3GHG4 Scheffersomyces stipitis SEC7 Guanine nucleotide exchange protein for ADP- robosylation factor"	""
"d1022.a1.a1"	12.3898564760907	62.2811378323957	75.8458968590941	122.114861127645	23.340183251025	2.90319256684782	45.891513719536	6.93152274026749	2.26909906739457	37.3254732941111	41.3712416929454	"Chassy_YL_B_985;YALI1_B26235g;YALI0B20086g1_1;Q6CDZ0;weakly similar to uniprot|P10662 Saccharomyces cerevisiae YDR347W MRP1 Mitochondrial ribosomal protein of the small subunit"	"Chassy_YL_B_985"	"YALI1_B26235g"	"YALI0B20086g1_1"	"Q6CDZ0"	"weakly similar to uniprot|P10662 Saccharomyces cerevisiae YDR347W MRP1 Mitochondrial ribosomal protein of the small subunit"	""
