"prot"	"HighTemp_A"	"HighTemp_B"	"HighTemp_C"	"LowpH_A"	"LowpH_B"	"LowpH_C"	"LowpH_D"	"standard_A"	"standard_B"	"standard_C"	"standard_D"	"Top.Protein.Description"	"Chassy_ID"	"W29_NCBI"	"CLIB122_NCBI"	"CLIB122_UNIPROT"	"Protein_name"	"ec_number"
"c664.a1.a1"	122.898982863152	145.159786103419	81.8449644870329	29.6906023129188	61.6792665252074	61.6162535042404	33.991284043567	100.883168440072	21.787619275793	67.5525561286337	89.5749835585278	"Chassy_YL_A_12;YALI1_A00325g;YALI0A00286g1_1;Q6CIA1;highly similar to uniprot|P39729 Saccharomyces cerevisiae YAL036c FUN11 probable GTP-binding protein"	"Chassy_YL_A_12"	"YALI1_A00325g"	"YALI0A00286g1_1"	"Q6CIA1"	"highly similar to uniprot|P39729 Saccharomyces cerevisiae YAL036c FUN11 probable GTP-binding protein"	""
"c665.a1.a1"	180.230769691892	255.665453089533	152.251585671848	99.9656363975735	69.9838179434753	137.214737046664	150.333523935475	228.362542689477	NA	138.616135471636	72.41647251064	"Chassy_YL_B_411;YALI1_B10607g;YALI0B08118g1_1;Q6CFD4;weakly similar to uniprot|C4R5M6 Komagataella pastoris hypothetical protein"	"Chassy_YL_B_411"	"YALI1_B10607g"	"YALI0B08118g1_1"	"Q6CFD4"	"weakly similar to uniprot|C4R5M6 Komagataella pastoris hypothetical protein"	""
"c666.a1.a1"	217.749811157066	211.133493007333	281.982668565891	112.813598747199	315.689480322568	309.312020884602	250.936476148808	265.443918058792	NA	278.190659186469	227.149751061904	"Chassy_YL_B_755;YALI1_B20052g;YALI0B15224g1_1;Q6CEJ2;highly similar to uniprot|P30656 Saccharomyces cerevisiae YPR103W PRE2 Beta 5 subunit of the 20S proteasome, responsible for the chymotryptic activity of the proteasome"	"Chassy_YL_B_755"	"YALI1_B20052g"	"YALI0B15224g1_1"	"Q6CEJ2"	"highly similar to uniprot|P30656 Saccharomyces cerevisiae YPR103W PRE2 Beta 5 subunit of the 20S proteasome, responsible for the chymotryptic activity of the proteasome"	""
"c667.a1.a1"	48.6745178564388	168.45882273131	206.520842349907	191.330574687416	117.961414494736	89.6528117617729	107.78853283369	32.5826916449128	NA	12.7336087971222	50.5617827184701	"Chassy_YL_E_1571;YALI1_E38706g;YALI0E32703g1_1;Q99158;uniprot|Q99158 Yarrowia lipolytica YALI0E32703g SLS1 Nucleotide exchange factor for Kar2p"	"Chassy_YL_E_1571"	"YALI1_E38706g"	"YALI0E32703g1_1"	"Q99158"	"uniprot|Q99158 Yarrowia lipolytica YALI0E32703g SLS1 Nucleotide exchange factor for Kar2p"	""
"c668.a1.a1"	214.180012973735	331.560360578835	224.87162030583	11.796161011943	28.4383536822876	12.2362958402447	9.10839827434708	196.652452377793	3.26531763425391	88.744178908864	166.091524637119	"Chassy_YL_D_100;YALI1_D02444g;YALI0D02167g1_1;Q6CAJ7;some similarities with uniprot|P38113 Saccharomyces cerevisiae YBR145W (ohnolog of YOL086C) ADH5 alcohol dehydrogenase V"	"Chassy_YL_D_100"	"YALI1_D02444g"	"YALI0D02167g1_1"	"Q6CAJ7"	"some similarities with uniprot|P38113 Saccharomyces cerevisiae YBR145W (ohnolog of YOL086C) ADH5 alcohol dehydrogenase V"	""
"c669.a1.a1"	41.1901004296891	65.4184552435686	44.4751998574513	81.8264973162089	58.9370043728265	84.1238785741697	87.5803802866713	66.365966111455	15.7388061017676	33.8836725087778	57.0691109905509	"Chassy_YL_C_224;YALI1_C06259g;YALI0C04774g1_1;Q6CD10;similar to uniprot|Q9C1M3 Emericella nidulans cdc11p Septin"	"Chassy_YL_C_224"	"YALI1_C06259g"	"YALI0C04774g1_1"	"Q6CD10"	"similar to uniprot|Q9C1M3 Emericella nidulans cdc11p Septin"	""
"c670.a1.a1"	53.1401631508603	81.0945389322421	164.798647774287	121.162878303969	95.7852713576425	91.8447503749813	92.2802733626769	35.404663306869	5.86654945004308	14.194355106165	125.151689275867	"Chassy_YL_B_610;YALI1_B16068g;YALI0B12210g1_1;Q6CEX2;similar to uniprot|P41391 Schizosaccharomyces pombe Ran GTPase activating protein 1 (Protein rna1)"	"Chassy_YL_B_610"	"YALI1_B16068g"	"YALI0B12210g1_1"	"Q6CEX2"	"similar to uniprot|P41391 Schizosaccharomyces pombe Ran GTPase activating protein 1 (Protein rna1)"	""
"c671.a1.a1"	79.3593117372128	64.9398608865358	701.560678305467	303.345122478941	380.618971977107	43.9070685577976	45.4979990232898	54.8098284158946	NA	37.2859076428931	679.843969964858	"Chassy_YL_E_1240;YALI1_E30914g;YALI0E26026g1_1;Q6C4K4;uniprot|Q6C4K4 Yarrowia lipolytica YALI0E26026g YET3 Endoplasmic reticulum transmembrane protein, putative"	"Chassy_YL_E_1240"	"YALI1_E30914g"	"YALI0E26026g1_1"	"Q6C4K4"	"uniprot|Q6C4K4 Yarrowia lipolytica YALI0E26026g YET3 Endoplasmic reticulum transmembrane protein, putative"	""
"c672.a1.a1"	48.907244266639	73.2518028016666	63.5801440305865	59.7542658162065	36.4360352063709	28.6778048482442	61.3511595551502	37.5633712815273	NA	51.3835912695004	33.7947313179855	"Chassy_YL_B_784;YALI1_B20730g;YALI0B15774g1_1;Q6CEG7;highly similar to uniprot|P12612 Saccharomyces cerevisiae YDR212w CCT1 component of chaperonin-containing T-complex"	"Chassy_YL_B_784"	"YALI1_B20730g"	"YALI0B15774g1_1"	"Q6CEG7"	"highly similar to uniprot|P12612 Saccharomyces cerevisiae YDR212w CCT1 component of chaperonin-containing T-complex"	""
"c673.a1.a1"	305.905693417024	164.105219183494	185.852082776292	109.449130612884	420.11321151615	371.579907955565	151.942629270065	241.192110240502	10.0162601117431	95.3933204982628	371.409054201667	"Chassy_YL_B_236;YALI1_B05995g;YALI0B04444g1_1;Q6CFR7;similar to uniprot|P38264 Saccharomyces cerevisiae YBR106W PHO88 Probable membrane protein, involved in phosphate transport"	"Chassy_YL_B_236"	"YALI1_B05995g"	"YALI0B04444g1_1"	"Q6CFR7"	"similar to uniprot|P38264 Saccharomyces cerevisiae YBR106W PHO88 Probable membrane protein, involved in phosphate transport"	""
"c674.a1.a1"	90.283367922255	127.346278928879	102.212447769038	104.444815824178	121.901881486476	115.616513504131	103.000358205014	112.548891185478	5.74847652320653	128.62178055285	115.017984841427	"Chassy_YL_E_1268;YALI1_E31565g;YALI0E26609g1_1;Q6C4I0;similar to uniprot|P23292 Saccharomyces cerevisiae YNL154C (ohnolog of YHR135C) YCK2 casein kinase I isoform"	"Chassy_YL_E_1268"	"YALI1_E31565g"	"YALI0E26609g1_1"	"Q6C4I0"	"similar to uniprot|P23292 Saccharomyces cerevisiae YNL154C (ohnolog of YHR135C) YCK2 casein kinase I isoform"	""
"c675.a1.a1"	81.3300486803225	83.0127400913489	95.5338106014635	99.9101361321248	109.433895270392	106.910529602286	67.484107716113	86.3703122081658	NA	112.074826904494	99.1771309106718	"Chassy_YL_B_840;YALI1_B22088g;YALI0B16984g1_1;Q6CEB4;uniprot|Q6CEB4 Yarrowia lipolytica YALI0B16984g RAS3 Ras GTP-binding protein"	"Chassy_YL_B_840"	"YALI1_B22088g"	"YALI0B16984g1_1"	"Q6CEB4"	"uniprot|Q6CEB4 Yarrowia lipolytica YALI0B16984g RAS3 Ras GTP-binding protein"	""
"c676.a1.a1"	2.32135221854377	7.15906676674835	7.04876450374449	2.34352187189544	NA	2.79130537115088	2.67608723059891	3.04081267407874	1.19108949846386	7.64795947227061	3.24284304544256	"Chassy_YL_C_850;YALI1_C23707g;YALI0C16566g1_1;Q6CBQ3;highly similar to uniprot|P04050 Saccharomyces cerevisiae YDL140c RPO21 DNA-directed RNA polymerase II, 215 KD subunit"	"Chassy_YL_C_850"	"YALI1_C23707g"	"YALI0C16566g1_1"	"Q6CBQ3"	"highly similar to uniprot|P04050 Saccharomyces cerevisiae YDL140c RPO21 DNA-directed RNA polymerase II, 215 KD subunit"	"2.7.7.6"
"c677.a1.a1"	101.786157689757	203.004115413282	177.57255165852	368.086907036209	222.597319995203	180.286509702136	226.018057781071	280.621599243082	3.32518583363455	237.7950583931	300.474941262925	"Chassy_YL_A_118;YALI1_A03170g;YALI0A02673g1_1;Q6CI09;similar to uniprot|A5DWP6 Lodderomyces elongisporus conserved hypothetical protein"	"Chassy_YL_A_118"	"YALI1_A03170g"	"YALI0A02673g1_1"	"Q6CI09"	"similar to uniprot|A5DWP6 Lodderomyces elongisporus conserved hypothetical protein"	""
"c678.a1.a1"	42.8748525973771	38.3298605038961	41.5636300855649	42.7160569321885	26.0742709297848	23.8984050533524	38.3505179483835	82.5893524712901	NA	40.9042501874164	60.3464605014552	"Chassy_YL_F_426;YALI1_F11658g;YALI0F08305g1_1;Q6C2F7;similar to uniprot|P29295 Saccharomyces cerevisiae YPL204w HRR25 casein kinase I"	"Chassy_YL_F_426"	"YALI1_F11658g"	"YALI0F08305g1_1"	"Q6C2F7"	"similar to uniprot|P29295 Saccharomyces cerevisiae YPL204w HRR25 casein kinase I"	""
"c679.a1.a1"	28.5876606278918	73.0813703001022	50.456391557718	15.9345112300889	44.5708359869712	31.774129328367	13.8141171796423	47.2920026657365	9.52192795505582	49.8919296288673	49.4523099270633	"Chassy_YL_E_1283;YALI1_E31897g;YALI0E26961g1_1;Q6C4G6;highly similar to uniprot|P02557 Saccharomyces cerevisiae YFL037w TUB2 beta-tubulin"	"Chassy_YL_E_1283"	"YALI1_E31897g"	"YALI0E26961g1_1"	"Q6C4G6"	"highly similar to uniprot|P02557 Saccharomyces cerevisiae YFL037w TUB2 beta-tubulin"	""
"c680.a1.a1"	62.6147695237268	133.727900075235	63.2600919870024	79.7455371151001	11.7357195875507	26.1456470702409	54.5048381043209	47.9673509170676	2.92288898296674	58.4601997573162	30.1604881046392	"Chassy_YL_D_453;YALI1_D11614g;YALI0D09119g1_1;Q6C9Q7;highly similar to uniprot|P33297 Saccharomyces cerevisiae YOR117w YTA1 26S proteasome regulatory subunit"	"Chassy_YL_D_453"	"YALI1_D11614g"	"YALI0D09119g1_1"	"Q6C9Q7"	"highly similar to uniprot|P33297 Saccharomyces cerevisiae YOR117w YTA1 26S proteasome regulatory subunit"	""
"c681.a1.a1"	25.7768794568065	14.15359610251	14.1346396358533	2.40385430134748	0.880732005941844	6.94156045053265	0.577360168246214	20.5405838085364	4.1508190857236	6.90081797638805	10.7693310536036	"Chassy_YL_D_781;YALI1_D20202g;YALI0D16335g1_1;Q6C8W6;similar to uniprot|P50101 Saccharomyces cerevisiae YMR304w UBP15"	"Chassy_YL_D_781"	"YALI1_D20202g"	"YALI0D16335g1_1"	"Q6C8W6"	"similar to uniprot|P50101 Saccharomyces cerevisiae YMR304w UBP15"	""
"c682.a1.a1"	51.5099375298062	115.96643439939	88.3358023702661	76.6982828819374	54.4469263260389	42.0324528476735	43.3229187250154	82.8830911938241	18.9496634037791	71.6010051551451	52.4333420455751	"Chassy_YL_E_402;YALI1_E10492g;YALI0E08617g1_1;Q6C6K9;weakly similar to uniprot|P41807 Saccharomyces cerevisiae YPR036w VMA13 H+-ATPase V1 domain 54 KD subunit, vacuolar"	"Chassy_YL_E_402"	"YALI1_E10492g"	"YALI0E08617g1_1"	"Q6C6K9"	"weakly similar to uniprot|P41807 Saccharomyces cerevisiae YPR036w VMA13 H+-ATPase V1 domain 54 KD subunit, vacuolar"	""
"c683.a1.a1"	96.3337605188395	131.674933550696	94.6280277322195	99.4781017920714	54.8262772842749	82.3305005388531	90.0856404621068	110.083374502877	5.51673493456872	69.6695713169525	48.0680880175986	"Chassy_YL_C_1054;YALI1_C29052g;YALI0C20999g1_1;Q6CB92;highly similar to uniprot|P42943 Saccharomyces cerevisiae YJL111w CCT7 component of chaperonin-containing T-complex"	"Chassy_YL_C_1054"	"YALI1_C29052g"	"YALI0C20999g1_1"	"Q6CB92"	"highly similar to uniprot|P42943 Saccharomyces cerevisiae YJL111w CCT7 component of chaperonin-containing T-complex"	""
"c684.a1.a1"	194.757253959635	269.265090888335	266.06201860022	158.993072154328	139.837413264386	167.747308608542	133.987420876108	303.583830459585	NA	240.926394874191	223.062651539626	"Chassy_YL_D_712;YALI1_D17885g;YALI0D14630g1_1;Q6C932;similar to uniprot|P51996 Saccharomyces cerevisiae YGL210W (ohnolog of YER031C) YPT32 small GTP-binding protein essential for Golgi function"	"Chassy_YL_D_712"	"YALI1_D17885g"	"YALI0D14630g1_1"	"Q6C932"	"similar to uniprot|P51996 Saccharomyces cerevisiae YGL210W (ohnolog of YER031C) YPT32 small GTP-binding protein essential for Golgi function"	""
"c685.a1.a1"	486.743146957303	415.859104906976	785.961466057863	54.3661110064432	75.2539979742089	62.1193542132514	48.8890213261288	368.990229526867	56.4681928903264	351.098403300579	593.74170754506	"Chassy_YL_D_160;YALI1_D04128g;YALI0D03245g1_1;Q6CAF5;highly similar to uniprot|Q6C2W4 Yarrowia lipolytica YALI0F04598g, unknown function"	"Chassy_YL_D_160"	"YALI1_D04128g"	"YALI0D03245g1_1"	"Q6CAF5"	"highly similar to uniprot|Q6C2W4 Yarrowia lipolytica YALI0F04598g, unknown function"	""
"c686.a1.a1"	777.227471437169	781.794687972716	447.952767478082	223.082812298258	195.078646459354	395.862416635022	181.842156964319	414.463108617652	71.1537678473062	307.26359438139	437.156497755798	"Chassy_YL_D_955;YALI1_D24626g;YALI0D19382g1_1;Q6C8I3;some similarities with uniprot|G3BCN3 Candida tenuis CANTEDRAFT_96280 hypothetical protein"	"Chassy_YL_D_955"	"YALI1_D24626g"	"YALI0D19382g1_1"	"Q6C8I3"	"some similarities with uniprot|G3BCN3 Candida tenuis CANTEDRAFT_96280 hypothetical protein"	""
"c687.a1.a1"	13.8304777001231	50.6349585959814	20.5764387572612	65.5335420187403	35.1092036427868	45.740838832285	58.2057555713663	52.5988067590341	7.26499436632367	49.6596642134806	21.4045153978609	"Chassy_YL_E_14;YALI1_E00510g;YALI0E00176g1_1;Q6C7K0;similar to uniprot|P19524 Saccharomyces cerevisiae YOR326W (ohnolog of YAL029C) MYO2 myosin heavy chain"	"Chassy_YL_E_14"	"YALI1_E00510g"	"YALI0E00176g1_1"	"Q6C7K0"	"similar to uniprot|P19524 Saccharomyces cerevisiae YOR326W (ohnolog of YAL029C) MYO2 myosin heavy chain"	""
"c688.a1.a1"	145.591389332335	193.460302968634	204.939827280468	205.077095340357	209.544791075348	225.242116648968	239.724425833233	216.186734897774	8.00499059220775	171.518953307977	196.006108214456	"Chassy_YL_A_128;YALI1_A03396g;YALI0A02981g1_1;Q6CHZ9;weakly similar to uniprot|Q9C232 Neurospora crassa Conserved hypothetical protein"	"Chassy_YL_A_128"	"YALI1_A03396g"	"YALI0A02981g1_1"	"Q6CHZ9"	"weakly similar to uniprot|Q9C232 Neurospora crassa Conserved hypothetical protein"	""
"c689.a1.a1"	144.589771692968	174.579963999536	143.536734497618	49.7180628521546	68.075222007345	57.4970792874284	55.9140048298173	135.67811522266	NA	135.921008232629	239.250867339264	"Chassy_YL_C_323;YALI1_C09133g;W29 specific;No Uniprot ID;No description in CLIB122"	"Chassy_YL_C_323"	"YALI1_C09133g"	""	""	"No description in CLIB122"	""
"c690.a1.a1"	41.5452771369586	32.4683840862136	57.6075293375499	67.7236878163806	126.750192888569	42.7797980388714	36.6350890418835	57.8804332450398	17.5821975473525	15.7692745659678	94.1316655075178	"Chassy_YL_B_543;YALI1_B14441g;YALI0B10780g1_1;Q6CF28;similar to uniprot|P39926 Saccharomyces cerevisiae YMR183C (ohnolog of YPL232W) SSO2 syntaxin (T-SNARE)"	"Chassy_YL_B_543"	"YALI1_B14441g"	"YALI0B10780g1_1"	"Q6CF28"	"similar to uniprot|P39926 Saccharomyces cerevisiae YMR183C (ohnolog of YPL232W) SSO2 syntaxin (T-SNARE)"	""
"c691.a1.a1"	97.6165649223532	168.747294961518	71.6267908056096	123.112128107936	87.6141422791554	150.30178233622	107.727752304919	175.013646748113	2.99451928311434	112.033871250419	112.698039036335	"Chassy_YL_B_321;YALI1_B08193g;YALI0B06116g1_1;Q6CFK6;similar to uniprot|P38120 Saccharomyces cerevisiae YBR146W MRPS9 Mitochondrial ribosomal protein of the small subunit"	"Chassy_YL_B_321"	"YALI1_B08193g"	"YALI0B06116g1_1"	"Q6CFK6"	"similar to uniprot|P38120 Saccharomyces cerevisiae YBR146W MRPS9 Mitochondrial ribosomal protein of the small subunit"	""
"c692.a1.a1"	142.603865725933	195.900772408222	146.923455582704	217.956861475878	157.39309601152	181.776533434562	243.095333316391	139.983754155356	14.802412174504	130.556724393243	172.160123499989	"Chassy_YL_D_885;YALI1_D22704g;YALI0D18150g1_1;Q6C8P0;weakly similar to uniprot|P36516 Saccharomyces cerevisiae YMR024w MRPL3 ribosomal protein of the large subunit, mitochondrial"	"Chassy_YL_D_885"	"YALI1_D22704g"	"YALI0D18150g1_1"	"Q6C8P0"	"weakly similar to uniprot|P36516 Saccharomyces cerevisiae YMR024w MRPL3 ribosomal protein of the large subunit, mitochondrial"	""
"c693.a1.a1"	26.1361697473794	25.9520387465075	14.9059420698548	17.1444557828687	10.1866975727818	9.7191794294406	9.63742552463733	16.3446677837944	6.43953910703198	18.3445528171922	9.95487475831672	"Chassy_YL_E_1389;YALI1_E34525g;YALI0E29249g1_1;Q6C470;similar to uniprot|P18759 Saccharomyces cerevisiae YBR080C SEC18 ATPase required for the release of Sec17p during the priming step in homotypic vacuole fusion and for ER to Golgi transport"	"Chassy_YL_E_1389"	"YALI1_E34525g"	"YALI0E29249g1_1"	"Q6C470"	"similar to uniprot|P18759 Saccharomyces cerevisiae YBR080C SEC18 ATPase required for the release of Sec17p during the priming step in homotypic vacuole fusion and for ER to Golgi transport"	""
"c694.a1.a1"	55.6941049376188	100.69001252931	65.2275108236266	61.7497386964396	56.9472692511005	53.8229666364673	53.5270355962099	61.7023819314192	NA	25.4040602866485	53.2829289632493	"Chassy_YL_F_833;YALI1_F21482g;YALI0F16005g1_1;Q6C1I3;similar to uniprot|Q7S9Y9 Neurospora crassa NCU07929.1 hypothetical protein"	"Chassy_YL_F_833"	"YALI1_F21482g"	"YALI0F16005g1_1"	"Q6C1I3"	"similar to uniprot|Q7S9Y9 Neurospora crassa NCU07929.1 hypothetical protein"	""
"c695.a1.a1"	291.256587527336	475.377930137916	353.130879662424	207.084131512298	271.168452651075	265.202595976147	56.6419328165331	355.204574507544	225.060438575	153.677529312716	334.875073824734	"Chassy_YL_E_1413;YALI1_E35082g;YALI0E29667g1_1;Q6C450;uniprot|Q6C450 Yarrowia lipolytica YALI0E29667g SDH3 Succinate dehydrogenase, putative"	"Chassy_YL_E_1413"	"YALI1_E35082g"	"YALI0E29667g1_1"	"Q6C450"	"uniprot|Q6C450 Yarrowia lipolytica YALI0E29667g SDH3 Succinate dehydrogenase, putative"	""
"c696.a1.a1"	179.759923070887	228.067947357669	202.237727023893	69.383977875053	109.679009716168	157.159613630004	80.167829797592	207.157042949552	29.0310469429613	203.837938852379	215.500234526661	"Chassy_YL_D_524;YALI1_D13226g;YALI0D10571g1_1;Q6C9K1;similar to uniprot|Q03392 Schizosaccharomyces pombe Proliferating cell nuclear antigen (PCNA)"	"Chassy_YL_D_524"	"YALI1_D13226g"	"YALI0D10571g1_1"	"Q6C9K1"	"similar to uniprot|Q03392 Schizosaccharomyces pombe Proliferating cell nuclear antigen (PCNA)"	""
"c697.a1.a1"	68.5343324466252	94.7902346658346	121.275375820058	70.8381792830763	104.213910761654	60.6502310171695	51.364361762103	85.6305255156822	9.2699998748994	69.5938576507637	116.325807253656	"Chassy_YL_B_742;YALI1_B19668g;YALI0B14971g1_1;Q6CEK4;weakly similar to uniprot|O42854 Schizosaccharomyces pombe Hypothetical 170.5 kDa protein"	"Chassy_YL_B_742"	"YALI1_B19668g"	"YALI0B14971g1_1"	"Q6CEK4"	"weakly similar to uniprot|O42854 Schizosaccharomyces pombe Hypothetical 170.5 kDa protein"	""
"c698.a1.a1"	59.8049624935315	108.223455365505	76.9573749535283	76.2686374434647	48.4670179253831	37.4891892042789	35.9325807335748	61.6268499058711	NA	45.1374182810311	54.2054418242288	"Chassy_YL_F_921;YALI1_F23867g;YALI0F17974g1_1;Q6C1A4;similar to uniprot|Q01532 Saccharomyces cerevisiae YNL239w Cysteine proteinase 1  (Bleomycin hydrolase)"	"Chassy_YL_F_921"	"YALI1_F23867g"	"YALI0F17974g1_1"	"Q6C1A4"	"similar to uniprot|Q01532 Saccharomyces cerevisiae YNL239w Cysteine proteinase 1  (Bleomycin hydrolase)"	""
"c699.a1.a1"	88.325335079583	88.6653547351017	83.6358896201269	72.5079423566823	80.8125577501116	69.0296823435427	61.249006259864	87.2137816430302	NA	48.8632209288835	55.1854941413099	"Chassy_YL_D_801;YALI1_D20695g;YALI0D16775g1_1;Q6C8V2;similar to uniprot|P38884 Saccharomyces cerevisiae YHR198c"	"Chassy_YL_D_801"	"YALI1_D20695g"	"YALI0D16775g1_1"	"Q6C8V2"	"similar to uniprot|P38884 Saccharomyces cerevisiae YHR198c"	""
"c700.a1.a1"	256.981527721861	294.103599605202	248.337510404957	178.374584488983	197.352371697674	210.073969055439	218.139317150781	317.640319576263	65.6815970719838	221.795116099536	260.603152848256	"Chassy_YL_B_859;YALI1_B22598g;YALI0B17380g1_1;Q6CE98;similar to uniprot|P38328 Saccharomyces cerevisiae YBR234c ARC40 ARP2/3 protein complex subunit, 40 kilodalton"	"Chassy_YL_B_859"	"YALI1_B22598g"	"YALI0B17380g1_1"	"Q6CE98"	"similar to uniprot|P38328 Saccharomyces cerevisiae YBR234c ARC40 ARP2/3 protein complex subunit, 40 kilodalton"	""
"c702.a1.a1"	148.028506656839	76.2132115591604	114.610767177639	21.8133267160985	148.682981835354	102.644403579926	23.0383092445441	160.945930043612	59.0842341771071	51.9828309381287	213.393630378133	"Chassy_YL_C_1101;YALI1_C30130g;YALI0C21824g1_1;Q6CB54;similar to uniprot|P20606 Saccharomyces cerevisiae YPL218w SAR1 GTP-binding protein of the ARF family"	"Chassy_YL_C_1101"	"YALI1_C30130g"	"YALI0C21824g1_1"	"Q6CB54"	"similar to uniprot|P20606 Saccharomyces cerevisiae YPL218w SAR1 GTP-binding protein of the ARF family"	"3.6.5.-"
"c703.a1.a1"	444.982875253204	623.717477386174	461.634912813845	934.406493061886	1044.29251897454	1306.46986300868	973.024556212898	794.049050873494	98.2684416227319	253.041576203692	764.609961986359	"Chassy_YL_E_1208;YALI1_E29930g;W29 specific;No Uniprot ID;No description in CLIB122"	"Chassy_YL_E_1208"	"YALI1_E29930g"	""	""	"No description in CLIB122"	""
"c704.a1.a1"	245.608719907516	175.235685081697	126.130911071926	52.0682685297551	56.3715860777035	51.159957597551	58.3694263338325	170.453824851342	71.9261325905617	136.502706363081	95.114189757132	"Chassy_YL_D_1173;YALI1_D30540g;YALI0D23617g1_1;Q6C815;weakly similar to uniprot|Q12164 Saccharomyces cerevisiae YLL023C Protein of unknown function"	"Chassy_YL_D_1173"	"YALI1_D30540g"	"YALI0D23617g1_1"	"Q6C815"	"weakly similar to uniprot|Q12164 Saccharomyces cerevisiae YLL023C Protein of unknown function"	""
"c705.a1.a1"	151.831023863145	135.353884305176	232.004259892038	168.284586710341	209.718938994754	168.633823481672	101.722096332582	166.543506124236	3.55404138762094	95.587103139934	262.176921970994	"Chassy_YL_C_412;YALI1_C11862g;YALI0C08635g1_1;Q6CCK5;similar to uniprot|P87216 Schizosaccharomyces pombe VIP1 protein (P53 antigen homolog)"	"Chassy_YL_C_412"	"YALI1_C11862g"	"YALI0C08635g1_1"	"Q6CCK5"	"similar to uniprot|P87216 Schizosaccharomyces pombe VIP1 protein (P53 antigen homolog)"	""
"c706.a1.a1"	89.4311609427846	112.056374494986	21.0117802451532	46.2713924099551	72.3719371885799	96.809851131672	30.1660964970294	94.2420395506307	4.84466894996507	88.7776307979561	103.527024775972	"Chassy_YL_D_427;YALI1_D11063g;YALI0D08602g1_1;Q6C9T1;some similarities with uniprot|Q08023 Saccharomyces cerevisiae YLR077w"	"Chassy_YL_D_427"	"YALI1_D11063g"	"YALI0D08602g1_1"	"Q6C9T1"	"some similarities with uniprot|Q08023 Saccharomyces cerevisiae YLR077w"	""
"c707.a1.a1"	59.5650524489697	92.8812001033144	93.8400159634786	80.2065170574191	76.9975388372063	80.2050118352387	86.6581993170136	70.9428494308729	40.9535921489507	82.9429148768438	81.1274104522022	"Chassy_YL_D_316;YALI1_D08360g;YALI0D06523g1_1;Q6CA23;highly similar to uniprot|P23724 Saccharomyces cerevisiae YBL041w PRE7 20S proteasome subunit(beta6)"	"Chassy_YL_D_316"	"YALI1_D08360g"	"YALI0D06523g1_1"	"Q6CA23"	"highly similar to uniprot|P23724 Saccharomyces cerevisiae YBL041w PRE7 20S proteasome subunit(beta6)"	""
"c708.a1.a1"	29.3521069435772	11.487076434974	12.2913779159579	18.6752957687144	14.201998233412	15.9149202832214	14.8928429609546	64.1983481880204	NA	14.4831002410775	27.3836700503698	"Chassy_YL_F_228;YALI1_F06544g;YALI0F04268g1_1;Q6C2X7;some similarities with uniprot|P38845 Saccharomyces cerevisiae YHR146W (ohnolog of YNL173C) Hypothetical 51.1 kDa protein in DCD1- MRPL6 intergenic region"	"Chassy_YL_F_228"	"YALI1_F06544g"	"YALI0F04268g1_1"	"Q6C2X7"	"some similarities with uniprot|P38845 Saccharomyces cerevisiae YHR146W (ohnolog of YNL173C) Hypothetical 51.1 kDa protein in DCD1- MRPL6 intergenic region"	""
"c709.a1.a1"	174.011291831733	185.610677762916	139.183156055355	84.4490703866054	123.893330038569	112.024831945924	84.3962513636851	205.467020769969	51.0120007484431	168.279230890641	169.208895814785	"Chassy_YL_A_259;YALI1_A06453g;YALI0A06787g1_1;Q6CHP1;similar to uniprot|P38286 Saccharomyces cerevisiae YBR159W Microsomal beta-keto-reductase"	"Chassy_YL_A_259"	"YALI1_A06453g"	"YALI0A06787g1_1"	"Q6CHP1"	"similar to uniprot|P38286 Saccharomyces cerevisiae YBR159W Microsomal beta-keto-reductase"	"1.1.1.330"
"c710.a1.a1"	31.169445793943	36.2935210963407	49.1421596364038	30.0853181847027	31.8493841352886	26.5322908089581	30.9027588682024	36.2969693010496	3.12186002203452	49.5854777561255	26.8911935136058	"Chassy_YL_F_1137;YALI1_F29424g;YALI0F22209g1_1;Q6C0S1;some similarities with uniprot|P40011 Saccharomyces cerevisiae YER010c"	"Chassy_YL_F_1137"	"YALI1_F29424g"	"YALI0F22209g1_1"	"Q6C0S1"	"some similarities with uniprot|P40011 Saccharomyces cerevisiae YER010c"	""
"c711.a1.a1"	87.9065717234782	86.4663530855783	41.6320120309366	36.3107059383765	42.9353616318684	66.7486799841845	52.6973952131122	84.205838722281	3.10341747703878	51.2314396602651	45.3646588753888	"Chassy_YL_D_549;YALI1_D13963g;YALI0D11110g1_1;Q6C9H7;similar to uniprot|P00937 Saccharomyces cerevisiae YKL211C TRP3 Bifunctional enzyme exhibiting both indole-3- glycerol-phosphate synthase and anthranilate synthase activities"	"Chassy_YL_D_549"	"YALI1_D13963g"	"YALI0D11110g1_1"	"Q6C9H7"	"similar to uniprot|P00937 Saccharomyces cerevisiae YKL211C TRP3 Bifunctional enzyme exhibiting both indole-3- glycerol-phosphate synthase and anthranilate synthase activities"	""
"c712.a1.a1"	57.3868030789614	107.664335678731	230.450059794582	188.561399994391	187.051666080281	69.9740984341501	140.416949526469	95.2160030908156	12.8234797710707	104.385179802466	211.909915251028	"Chassy_YL_B_707;YALI1_B18811g;YALI0B14267g1_1;Q6CEN6;highly similar to uniprot|P40303 Saccharomyces cerevisiae YOL038w PRE6 20S proteasome subunit (alpha4)"	"Chassy_YL_B_707"	"YALI1_B18811g"	"YALI0B14267g1_1"	"Q6CEN6"	"highly similar to uniprot|P40303 Saccharomyces cerevisiae YOL038w PRE6 20S proteasome subunit (alpha4)"	"3.4.25.1"
"c713.a1.a1"	5.84993672187662	9.92469167445145	4.94412387613721	16.2399242823211	25.1484569892506	9.72832072038531	14.1576700429763	18.3105026748379	2.02088371983715	14.7046325831678	40.3727974234623	"Chassy_YL_C_645;YALI1_C17782g;YALI0C12595g1_1;Q6CC44;similar to uniprot|Q02895 Saccharomyces cerevisiae YPL088w putative aryl-alcohol dehydrogenase"	"Chassy_YL_C_645"	"YALI1_C17782g"	"YALI0C12595g1_1"	"Q6CC44"	"similar to uniprot|Q02895 Saccharomyces cerevisiae YPL088w putative aryl-alcohol dehydrogenase"	""
