"prot"	"HighTemp_A"	"HighTemp_B"	"HighTemp_C"	"LowpH_A"	"LowpH_B"	"LowpH_C"	"LowpH_D"	"standard_A"	"standard_B"	"standard_C"	"standard_D"	"Top.Protein.Description"	"Chassy_ID"	"W29_NCBI"	"CLIB122_NCBI"	"CLIB122_UNIPROT"	"Protein_name"	"ec_number"
"c326.a1.a1"	718.642018681086	677.990216472885	520.442422745806	329.581321288791	515.323166797153	433.774705262233	370.763103352851	667.860766235033	146.172227566759	758.436516771734	818.994157613579	"Chassy_YL_D_1059;YALI1_D27148g;YALI0D21530g1_1;Q6C897;uniprot|Q6C897 Yarrowia lipolytica YALI0D21530g IMD4 IMP dehydrogenase"	"Chassy_YL_D_1059"	"YALI1_D27148g"	"YALI0D21530g1_1"	"Q6C897"	"uniprot|Q6C897 Yarrowia lipolytica YALI0D21530g IMD4 IMP dehydrogenase"	"1.1.1.205"
"c327.a1.a1"	659.376319686991	1160.21482615284	1086.12272208028	466.802585200302	405.226086595706	388.182748502538	387.595989313857	696.440201823157	170.345458044849	872.972399570154	790.547125658601	"Chassy_YL_E_844;YALI1_E21406g;YALI0E18029g1_1;Q6C5H4;similar to uniprot|P41921 Saccharomyces cerevisiae YPL091w GLR1 glutathione reductase (NADPH)"	"Chassy_YL_E_844"	"YALI1_E21406g"	"YALI0E18029g1_1"	"Q6C5H4"	"similar to uniprot|P41921 Saccharomyces cerevisiae YPL091w GLR1 glutathione reductase (NADPH)"	"1.8.1.7"
"c328.a1.a1"	348.537344464859	1097.43288420924	1038.93042214782	949.567962019363	693.46365079953	752.682788732687	1435.56649014604	674.097665884556	174.68782196881	1125.89843588418	537.687294901555	"Chassy_YL_D_291;YALI1_D07729g;YALI0D06039g1_1;Q6CA43;uniprot|Q6CA43 Yarrowia lipolytica YALI0D06039g PHR1 Cell surface glycosidase expressed at alkaline pH"	"Chassy_YL_D_291"	"YALI1_D07729g"	"YALI0D06039g1_1"	"Q6CA43"	"uniprot|Q6CA43 Yarrowia lipolytica YALI0D06039g PHR1 Cell surface glycosidase expressed at alkaline pH"	"2.4.1.-"
"c329.a1.a1"	810.050796296806	1477.75314600583	4848.59308011568	1169.90371814055	831.421340762241	408.839475855751	542.242323276324	614.633993721627	197.208397784074	690.598256686089	1706.14975862509	"Chassy_YL_B_460;YALI1_B11983g;YALI0B08921g1_1;Q6CFA1;uniprot|Q6CFA1 Yarrowia lipolytica YALI0B08921g SOD2 Superoxide dismutase"	"Chassy_YL_B_460"	"YALI1_B11983g"	"YALI0B08921g1_1"	"Q6CFA1"	"uniprot|Q6CFA1 Yarrowia lipolytica YALI0B08921g SOD2 Superoxide dismutase"	"1.15.1.1"
"c330.a1.a1"	5635.44161789234	5184.91660165023	5288.85216357836	6388.229982045	6803.50920548057	6455.80744414608	6738.24309714824	6030.81481929794	2139.14634150785	5342.4507982895	6536.36222586946	"Chassy_YL_F_1052;YALI1_F27175g;YALI0F20482g1_1;Q6C0Z7;highly similar to uniprot|P0CX47 Saccharomyces cerevisiae YDR025W (ohnolog of YBR048W) RPS11A ribosomal protein"	"Chassy_YL_F_1052"	"YALI1_F27175g"	"YALI0F20482g1_1"	"Q6C0Z7"	"highly similar to uniprot|P0CX47 Saccharomyces cerevisiae YDR025W (ohnolog of YBR048W) RPS11A ribosomal protein"	""
"c331.a1.a1"	423.226930539291	411.612877921553	284.771894669602	455.59758457232	767.561128684478	1077.06968223502	510.117545465392	538.369205782865	NA	308.228304318874	422.534873427865	"Chassy_YL_C_1179;YALI1_C32184g;YALI0C23364g1_1;Q6CAY4;similar to uniprot|P31382 Saccharomyces cerevisiae YAL023C (ohnolog of YOR321W) PMT2 mannosyltransferase"	"Chassy_YL_C_1179"	"YALI1_C32184g"	"YALI0C23364g1_1"	"Q6CAY4"	"similar to uniprot|P31382 Saccharomyces cerevisiae YAL023C (ohnolog of YOR321W) PMT2 mannosyltransferase"	""
"c332.a1.a1"	604.194216513122	956.803351177748	449.858481626888	423.557969342033	506.695627289653	529.477666818818	294.378165413678	837.78918593921	70.7268894733559	473.415618748559	606.018236345524	"Chassy_YL_F_887;YALI1_F22993g;YALI0F17248g1_1;F2Z626;uniprot|Q9UUU1 Yarrowia lipolytica YALI0F17248g NUCM Central subunit of protein NADH:ubiquinone oxidoreductase (Complex I)"	"Chassy_YL_F_887"	"YALI1_F22993g"	"YALI0F17248g1_1"	"F2Z626"	"uniprot|Q9UUU1 Yarrowia lipolytica YALI0F17248g NUCM Central subunit of protein NADH:ubiquinone oxidoreductase (Complex I)"	""
"c333.a1.a1"	1613.99155079584	2669.77067915333	1470.3567430641	1899.9605898479	983.668960079045	1757.21611470643	2072.09134272143	1718.20035920164	542.801674817091	1411.36798465728	1114.83521187334	"Chassy_YL_E_330;YALI1_E08382g;YALI0E07073g1_1;Q6C6R1;highly similar to uniprot|P43619 Saccharomyces cerevisiae YFR047c putative nicotinate-nucleotide pyrophosphorylase [carboxylating]"	"Chassy_YL_E_330"	"YALI1_E08382g"	"YALI0E07073g1_1"	"Q6C6R1"	"highly similar to uniprot|P43619 Saccharomyces cerevisiae YFR047c putative nicotinate-nucleotide pyrophosphorylase [carboxylating]"	"2.4.2.19"
"c334.a1.a1"	2311.0501819996	2645.28806765653	1849.25745211579	470.602709382552	1373.75645255133	1108.84047769924	912.420933082757	3766.89729548939	1974.12929876144	2641.53537231757	3374.82315332852	"Chassy_YL_D_535;YALI1_D13510g;YALI0D10813g1_1;Q6C9J1;similar to uniprot|Q9P866 Candida albicans Phosphatidylinositol phospholipase C"	"Chassy_YL_D_535"	"YALI1_D13510g"	"YALI0D10813g1_1"	"Q6C9J1"	"similar to uniprot|Q9P866 Candida albicans Phosphatidylinositol phospholipase C"	""
"c335.a1.a1"	510.131138368648	606.207708846893	425.133942451382	195.337593399457	215.961955499796	242.078047652427	174.696016146605	431.60118713162	19.566506091831	225.373878379258	344.998972744546	"Chassy_YL_B_1089;YALI1_B29133g;YALI0B22308g1_1;F2Z672;uniprot|O74996 Yarrowia lipolytica YALI0B22308g HXK1 Hexokinase"	"Chassy_YL_B_1089"	"YALI1_B29133g"	"YALI0B22308g1_1"	"F2Z672"	"uniprot|O74996 Yarrowia lipolytica YALI0B22308g HXK1 Hexokinase"	"2.7.1.-"
"c336.a1.a1"	855.418971893785	1703.75828288917	1753.79795627854	941.12886155435	624.387223212133	505.307515047845	620.166206155289	883.565087522378	39.6635044933473	540.400845953003	1203.21782557821	"Chassy_YL_C_688;YALI1_C18771g;YALI0C13508g1_1;Q6CC16;uniprot|Q6CC16 Yarrowia lipolytica YALI0C13508g ARA12 Protein of aldo/keto reductase family"	"Chassy_YL_C_688"	"YALI1_C18771g"	"YALI0C13508g1_1"	"Q6CC16"	"uniprot|Q6CC16 Yarrowia lipolytica YALI0C13508g ARA12 Protein of aldo/keto reductase family"	""
"c337.a1.a1"	1432.17221922703	1233.44963963564	981.190507515173	1078.47117806897	1681.70842811144	2399.36200758838	1506.69658824992	1896.11031962961	27.2970843229818	1086.05865822822	1771.6173729926	"Chassy_YL_C_574;YALI1_C16108g;W29 specific;Q6CC88;No description in CLIB122"	"Chassy_YL_C_574"	"YALI1_C16108g"	""	"Q6CC88"	"No description in CLIB122"	""
"c338.a1.a1"	1074.64453562484	1774.2260656851	3491.05659359349	2976.34354213163	2400.20587068336	1588.28943392757	1715.83332187718	1213.88641486167	390.836343663829	1126.60851922031	2052.99556922753	"Chassy_YL_E_26;YALI1_E00760g;YALI0E00418g1_1;Q6C7J1;highly similar to uniprot|Q9C2Y6 Saccharomyces pastorianus MET14-CA Adenosine-5 -phosphosulfate kinase"	"Chassy_YL_E_26"	"YALI1_E00760g"	"YALI0E00418g1_1"	"Q6C7J1"	"highly similar to uniprot|Q9C2Y6 Saccharomyces pastorianus MET14-CA Adenosine-5 -phosphosulfate kinase"	"2.7.1.25"
"c339.a1.a1"	472.769049172854	1038.45366770868	1105.87911036167	1615.13040747113	798.634376600688	1154.94890392886	1613.61343489045	741.181764400022	344.348234124923	864.152934076189	695.826687026738	"Chassy_YL_B_817;YALI1_B21493g;YALI0B16500g1_1;Q6CED6;similar to uniprot|P09232 Saccharomyces cerevisiae YEL060C (ohnolog of YOR003W) PRB1 protease B, vacuolar"	"Chassy_YL_B_817"	"YALI1_B21493g"	"YALI0B16500g1_1"	"Q6CED6"	"similar to uniprot|P09232 Saccharomyces cerevisiae YEL060C (ohnolog of YOR003W) PRB1 protease B, vacuolar"	""
"c340.a1.a1"	99.1782613376806	122.929785200192	107.230476388422	61.2930810299577	60.1204455073626	92.7122322723151	74.0074523646275	95.1109005121887	4.53577954990619	125.789252311244	87.882165885023	"Chassy_YL_E_795;YALI1_E20269g;YALI0E16995g1_1;Q6C5L5;similar to uniprot|P15303 Saccharomyces cerevisiae YPR181c SEC23 component of COPII coat of ER-golgi vesicles"	"Chassy_YL_E_795"	"YALI1_E20269g"	"YALI0E16995g1_1"	"Q6C5L5"	"similar to uniprot|P15303 Saccharomyces cerevisiae YPR181c SEC23 component of COPII coat of ER-golgi vesicles"	""
"c341.a1.a1"	3967.79552729874	4846.97711454522	6581.61595749012	5383.25595136898	4386.26476313642	4831.46595465664	4874.02955188235	4590.60957094179	905.358346016556	2796.76896254338	5555.98336435056	"Chassy_YL_B_312;YALI1_B07937g;YALI0B05896g1_1;Q6CFL3;similar to uniprot|P0C2H6 Saccharomyces cerevisiae YHR010W (ohnolog of YDR471W) RPL27A 60S large subunit ribosomal protein"	"Chassy_YL_B_312"	"YALI1_B07937g"	"YALI0B05896g1_1"	"Q6CFL3"	"similar to uniprot|P0C2H6 Saccharomyces cerevisiae YHR010W (ohnolog of YDR471W) RPL27A 60S large subunit ribosomal protein"	""
"c342.a1.a1"	409.622185871061	553.062292814698	278.292010500392	160.397606046491	308.200568229289	315.158574520395	117.126613669077	512.544141440531	114.530684845925	337.965282456202	348.492654491117	"Chassy_YL_E_235;YALI1_E05907g;YALI0E05005g1_1;Q6C6Z7;similar to uniprot|P38707 Saccharomyces cerevisiae YHR019c DED81 asparaginyl-tRNA-synthetase"	"Chassy_YL_E_235"	"YALI1_E05907g"	"YALI0E05005g1_1"	"Q6C6Z7"	"similar to uniprot|P38707 Saccharomyces cerevisiae YHR019c DED81 asparaginyl-tRNA-synthetase"	""
"c343.a1.a1"	315.185724165776	384.836204794032	356.153217071474	473.968253358501	664.514625970551	767.086057550415	647.920999748404	570.848766865819	207.751038587624	447.678679171707	505.21358076416	"Chassy_YL_F_922;YALI1_F23922g;YALI0F17996g2_1;Q6C1A3;uniprot|Q6C1A3 Yarrowia lipolytica YALI0F17996g ABC5lf Plasma membrane ATP-binding cassette (ABC) transporter, putative"	"Chassy_YL_F_922"	"YALI1_F23922g"	"YALI0F17996g2_1"	"Q6C1A3"	"uniprot|Q6C1A3 Yarrowia lipolytica YALI0F17996g ABC5lf Plasma membrane ATP-binding cassette (ABC) transporter, putative"	""
"c343.a2.a1"	4.73145468826224	14.1235206069648	11.2807866295177	17.7932318622652	1.53621537392581	7.1633302948154	18.9297311726422	6.60070335621126	NA	11.7085657920801	5.00757483019662	"Chassy_YL_C_1027;YALI1_C28310g;YALI0C20265g1_1;Q6CBB8;uniprot|Q6CBB8 Yarrowia lipolytica YALI0C20265g ABC2 Plasma membrane ATP-binding cassette (ABC) transporter"	"Chassy_YL_C_1027"	"YALI1_C28310g"	"YALI0C20265g1_1"	"Q6CBB8"	"uniprot|Q6CBB8 Yarrowia lipolytica YALI0C20265g ABC2 Plasma membrane ATP-binding cassette (ABC) transporter"	""
"c344.a1.a1"	880.735610878283	1277.00651777129	1052.81288444563	595.125347054555	470.723355880224	638.626370244406	592.423963400071	998.51440056629	161.041038831805	911.929871103046	1066.75316914323	"Chassy_YL_A_446;YALI1_A11270g;YALI0A11157g1_1;Q6CH90;highly similar to uniprot|Q07478 Saccharomyces cerevisiae YDL084w SUB2 Probable ATP-dependent RNA helicase involved in pre-mRNA splicing"	"Chassy_YL_A_446"	"YALI1_A11270g"	"YALI0A11157g1_1"	"Q6CH90"	"highly similar to uniprot|Q07478 Saccharomyces cerevisiae YDL084w SUB2 Probable ATP-dependent RNA helicase involved in pre-mRNA splicing"	"3.6.4.13"
"c345.a1.a1"	576.230153612384	916.155198988853	913.320962868269	666.171301387111	863.417258016975	1017.15068670654	715.309037556097	787.646840787334	174.184337388835	679.649323884541	865.35849857115	"Chassy_YL_C_747;YALI1_C20198g;YALI0C14498g1_1;Q6CBY2;highly similar to uniprot|P38988 Saccharomyces cerevisiae YDL198C GGC1 Mitochondrial GTP/GDP transporter, essential for mitochondrial genome maintenance"	"Chassy_YL_C_747"	"YALI1_C20198g"	"YALI0C14498g1_1"	"Q6CBY2"	"highly similar to uniprot|P38988 Saccharomyces cerevisiae YDL198C GGC1 Mitochondrial GTP/GDP transporter, essential for mitochondrial genome maintenance"	""
"c346.a1.a1"	118.535169867527	120.142079477923	101.593939795559	16.5518911657497	50.8147987246013	84.37493127948	32.5831137106805	160.602972415897	NA	69.7644452399128	55.4436121914431	"Chassy_YL_D_1070;YALI1_D27500g;YALI0D21736g1_1;No Uniprot ID;weakly similar to uniprot|P38853 Saccharomyces cerevisiae YHR158C (ohnolog of YGR238C) KEL1 involved in cell fusion and morphology"	"Chassy_YL_D_1070"	"YALI1_D27500g"	"YALI0D21736g1_1"	""	"weakly similar to uniprot|P38853 Saccharomyces cerevisiae YHR158C (ohnolog of YGR238C) KEL1 involved in cell fusion and morphology"	""
"c347.a1.a1"	896.845193050063	864.591854805787	1264.0464763646	58.6560115417674	272.264438433701	173.503447780159	84.7012572787782	1194.96159632258	619.10228385075	1374.15310566977	1419.1346656695	"Chassy_YL_A_836;YALI1_A20995g;YALI0A19888g1_1;Q6CGF0;similar to uniprot|A5DBK5 Meyerozyma guilliermondii hypothetical protein PGUG_00660"	"Chassy_YL_A_836"	"YALI1_A20995g"	"YALI0A19888g1_1"	"Q6CGF0"	"similar to uniprot|A5DBK5 Meyerozyma guilliermondii hypothetical protein PGUG_00660"	""
"c348.a1.a1"	516.311106685407	906.815564563669	719.556629669199	266.751113208737	189.641370291252	260.306903453626	245.03995547267	650.233267586294	170.463533869225	565.398552723767	528.780235727461	"Chassy_YL_D_345;YALI1_D09055g;YALI0D07084g1_1;Q6C9Z7;similar to uniprot|Q03161 Saccharomyces cerevisiae YMR099c conserved protein"	"Chassy_YL_D_345"	"YALI1_D09055g"	"YALI0D07084g1_1"	"Q6C9Z7"	"similar to uniprot|Q03161 Saccharomyces cerevisiae YMR099c conserved protein"	"5.1.3.15"
"c349.a1.a1"	2113.36896931935	1523.6991268643	1324.74891766764	2599.44736357853	3288.63821046326	3679.14308416669	2670.55461803052	2658.98975900271	1105.2796737818	1437.36666198626	2421.73470237351	"Chassy_YL_E_1124;YALI1_E27880g;YALI0E23584g1_1;Q6C4U6;similar to uniprot|P24000 Saccharomyces cerevisiae YGR148C (ohnolog of YGL031C) RPL24B Ribosomal protein L30 of the large (60S) ribosomal subunit"	"Chassy_YL_E_1124"	"YALI1_E27880g"	"YALI0E23584g1_1"	"Q6C4U6"	"similar to uniprot|P24000 Saccharomyces cerevisiae YGR148C (ohnolog of YGL031C) RPL24B Ribosomal protein L30 of the large (60S) ribosomal subunit"	""
"c350.a1.a1"	156.530616410725	258.297854010616	203.695083345334	172.529490983473	128.270599313101	107.330714596458	136.406190826524	177.271306026046	59.6162083487068	169.955180213474	107.43779055032	"Chassy_YL_C_172;YALI1_C04882g;YALI0C03674g1_1;Q6CD53;similar to uniprot|P13188 Saccharomyces cerevisiae YOR168W GLN4 Glutamine tRNA synthetase"	"Chassy_YL_C_172"	"YALI1_C04882g"	"YALI0C03674g1_1"	"Q6CD53"	"similar to uniprot|P13188 Saccharomyces cerevisiae YOR168W GLN4 Glutamine tRNA synthetase"	""
"c350.a2.a1"	4.01355407822928	15.6147377898177	4.5487341354892	15.8130372353992	7.28906263181259	7.73176666625691	21.263264943225	4.31416674712005	NA	5.14751785146415	6.13426051201648	"Chassy_YL_F_937;YALI1_F24247g;YALI0F18282g1_1;Q6C191;weakly similar to uniprot|Q8TFK5 Yarrowia lipolytica YALI0E18788g CWP1 Cell wall protein of the PIR family"	"Chassy_YL_F_937"	"YALI1_F24247g"	"YALI0F18282g1_1"	"Q6C191"	"weakly similar to uniprot|Q8TFK5 Yarrowia lipolytica YALI0E18788g CWP1 Cell wall protein of the PIR family"	""
"c350.a3.a1"	30.3992510626407	43.758301837083	37.2870340856759	NA	NA	NA	NA	NA	NA	NA	NA	"Chassy_YL_E_548;YALI1_E14350g;YALI0E11517g1_1;Q6C689;weakly similar to uniprot|Q8TFK5 Yarrowia lipolytica YALI0E18788g CWP1 Cell wall protein of the PIR family"	"Chassy_YL_E_548"	"YALI1_E14350g"	"YALI0E11517g1_1"	"Q6C689"	"weakly similar to uniprot|Q8TFK5 Yarrowia lipolytica YALI0E18788g CWP1 Cell wall protein of the PIR family"	""
"c351.a1.a1"	477.904741950959	597.783385330219	570.633203481318	345.814574504156	358.334012269017	346.952070323312	352.070251057822	1114.77176771808	164.485027737781	1009.25728815235	795.799610924376	"Chassy_YL_B_767;YALI1_B20289g;YALI0B15444g1_1;P38997;uniprot|P38997 Yarrowia lipolytica YALI0B15444g LYS5 Saccharopine dehydrogenase"	"Chassy_YL_B_767"	"YALI1_B20289g"	"YALI0B15444g1_1"	"P38997"	"uniprot|P38997 Yarrowia lipolytica YALI0B15444g LYS5 Saccharopine dehydrogenase"	"1.5.1.7"
"c352.a1.a1"	105.979628819671	200.020016150339	123.476997421011	132.733315031235	90.2662459295124	145.923094655506	142.414895129411	250.363664990454	51.3155124422461	193.452575925718	173.814743899036	"Chassy_YL_E_1075;YALI1_E26930g;YALI0E22781g1_1;Q6C4Y2;weakly similar to uniprot|P38713 Saccharomyces cerevisiae YHR073w OSH3 similarity to OSH1P, YDL019C (ohnolog of YAR042W) and mammalian oxysterol-binding protein"	"Chassy_YL_E_1075"	"YALI1_E26930g"	"YALI0E22781g1_1"	"Q6C4Y2"	"weakly similar to uniprot|P38713 Saccharomyces cerevisiae YHR073w OSH3 similarity to OSH1P, YDL019C (ohnolog of YAR042W) and mammalian oxysterol-binding protein"	""
"c353.a1.a1"	383.437817421844	520.096717319623	278.462938659187	286.204658453548	362.468985056262	372.213951064638	252.497241337037	468.319968467429	165.651503920179	375.340285039401	387.6510336087	"Chassy_YL_D_404;YALI1_D10424g;YALI0D08162g1_1;Q6C9V1;highly similar to uniprot|P33723 Neurospora crassa GTP-binding protein ypt1"	"Chassy_YL_D_404"	"YALI1_D10424g"	"YALI0D08162g1_1"	"Q6C9V1"	"highly similar to uniprot|P33723 Neurospora crassa GTP-binding protein ypt1"	""
"c353.a2.a1"	32.2229006642128	21.0139558805252	11.333277587254	2.34574590161526	28.0944436389429	27.0825145891003	4.38151527272703	44.1713278848388	10.1569665060922	13.2230620613765	24.9611240755187	"Chassy_YL_E_1088;YALI1_E27207g;YALI0E23067g1_1;P41924;uniprot|P41924 Yarrowia lipolytica YALI0E23067g RYL1 Ras-like GTP-binding protein"	"Chassy_YL_E_1088"	"YALI1_E27207g"	"YALI0E23067g1_1"	"P41924"	"uniprot|P41924 Yarrowia lipolytica YALI0E23067g RYL1 Ras-like GTP-binding protein"	""
"c354.a1.a1"	202.176072865337	566.331370502357	396.18217898366	465.161257690068	238.389091709841	267.466763461231	605.343278027073	321.05523928123	9.65024122507164	280.899490179365	174.24471996481	"Chassy_YL_E_93;YALI1_E02377g;YALI0E01870g1_1;Q6C7C8;similar to uniprot|P46680 Saccharomyces cerevisiae YMR092c AIP1 actin cytoskeleton component"	"Chassy_YL_E_93"	"YALI1_E02377g"	"YALI0E01870g1_1"	"Q6C7C8"	"similar to uniprot|P46680 Saccharomyces cerevisiae YMR092c AIP1 actin cytoskeleton component"	""
"c355.a1.a1"	582.106205364978	828.504395022419	609.63009412887	456.726855074837	542.56798100442	501.864099334892	521.12747446169	577.81933299164	117.610876971456	471.338091094605	592.995927845941	"Chassy_YL_B_63;YALI1_B01628g;YALI0B00946g1_1;Q6CG46;highly similar to uniprot|Q12499 Saccharomyces cerevisiae YOR310C NOP58 Protein involved in pre-rRNA processing, 18S rRNA synthesis, and snoRNA synthesis"	"Chassy_YL_B_63"	"YALI1_B01628g"	"YALI0B00946g1_1"	"Q6CG46"	"highly similar to uniprot|Q12499 Saccharomyces cerevisiae YOR310C NOP58 Protein involved in pre-rRNA processing, 18S rRNA synthesis, and snoRNA synthesis"	""
"c356.a1.a1"	1061.03082755569	1186.99190568307	1333.38532908676	893.722991807314	1075.6768828519	1248.94307071932	846.456754270328	1043.96235594576	1018.68944955509	955.69330630372	1520.56192896571	"Chassy_YL_B_357;YALI1_B09090g;YALI0B07007g1_1;Q6CFH1;similar to uniprot|Q9Y763 Phanerochaete chrysosporium 1, 4-benzoquinone reductase"	"Chassy_YL_B_357"	"YALI1_B09090g"	"YALI0B07007g1_1"	"Q6CFH1"	"similar to uniprot|Q9Y763 Phanerochaete chrysosporium 1, 4-benzoquinone reductase"	""
"c357.a1.a1"	220.204420541184	504.274714403662	529.354465994195	310.657259541056	192.949262216832	216.943872052336	320.483432242499	396.246158234574	20.6034119547702	310.123651991476	307.011760774177	"Chassy_YL_B_581;YALI1_B15380g;YALI0B11594g1_1;Q6CEZ5;similar to uniprot|Q96UQ4 Aspergillus niger Aminopeptidase B"	"Chassy_YL_B_581"	"YALI1_B15380g"	"YALI0B11594g1_1"	"Q6CEZ5"	"similar to uniprot|Q96UQ4 Aspergillus niger Aminopeptidase B"	"3.4.11.-"
"c358.a1.a1"	389.831269791037	674.612500919112	1591.76876906696	414.316545577461	329.269386096575	179.49619824366	314.950520992567	206.563162487621	NA	135.26179664411	508.340619909621	"Chassy_YL_C_431;YALI1_C12333g;YALI0C08987g1_1;Q6CCI8;uniprot|Q6CCI8 Yarrowia lipolytica YALI0C08987g STI1 Hsp90 cochaperone"	"Chassy_YL_C_431"	"YALI1_C12333g"	"YALI0C08987g1_1"	"Q6CCI8"	"uniprot|Q6CCI8 Yarrowia lipolytica YALI0C08987g STI1 Hsp90 cochaperone"	""
"c359.a1.a1"	483.588907373725	601.169395428468	794.188561108437	341.445110299228	334.214424667325	262.598653753984	325.20597817125	580.147394175718	33.475669933679	629.518485374928	698.394063629431	"Chassy_YL_D_785;YALI1_D20329g;YALI0D16423g1_1;Q6C8W2;some similarities with uniprot|Q03362 Saccharomyces cerevisiae YDR476c hypothetical protein"	"Chassy_YL_D_785"	"YALI1_D20329g"	"YALI0D16423g1_1"	"Q6C8W2"	"some similarities with uniprot|Q03362 Saccharomyces cerevisiae YDR476c hypothetical protein"	""
"c360.a1.a1"	101.838436944649	197.040103848775	140.809196786301	218.573417863086	139.189360678158	179.535133057971	217.740284024105	199.748135008985	18.923339212036	199.154305744464	132.269730622322	"Chassy_YL_F_666;YALI1_F16984g;YALI0F12639g1_1;Q6C1X5;similar to uniprot|P08566 Saccharomyces cerevisiae YDR127W ARO1 Pentafunctional arom protein, catalyzes steps 2 through 6 in the biosynthesis of chorismate, which is a precursor to aromatic amino acids"	"Chassy_YL_F_666"	"YALI1_F16984g"	"YALI0F12639g1_1"	"Q6C1X5"	"similar to uniprot|P08566 Saccharomyces cerevisiae YDR127W ARO1 Pentafunctional arom protein, catalyzes steps 2 through 6 in the biosynthesis of chorismate, which is a precursor to aromatic amino acids"	"4.2.3.4; 2.5.1.19; 2.7.1.71; 4.2.1.10; 1.1.1.25"
"c361.a1.a1"	1100.07688474837	2021.18022519649	1690.73869000625	1621.67677683055	1073.61582193068	1049.73310230558	1356.64805913513	1653.29037891566	662.476707379612	1126.55675055401	1429.26633640259	"Chassy_YL_F_1188;YALI1_F30754g;YALI0F23463g1_1;Q6C0M3;similar to uniprot|P47143 Saccharomyces cerevisiae YJR105w ADO1 Adenosine kinase, required for the utilization of S-adenosylmethionine"	"Chassy_YL_F_1188"	"YALI1_F30754g"	"YALI0F23463g1_1"	"Q6C0M3"	"similar to uniprot|P47143 Saccharomyces cerevisiae YJR105w ADO1 Adenosine kinase, required for the utilization of S-adenosylmethionine"	""
"c362.a1.a1"	507.087851955171	462.031121712134	473.890262286044	254.143112294542	389.276215113774	484.016018627106	400.41766724836	641.73569539142	24.6882080109723	460.336951880896	496.939334254349	"Chassy_YL_A_568;YALI1_A14345g;YALI0A14542g1_1;F2Z6H7;uniprot|Q8WZL8 Yarrowia lipolytica YALI0A14542g TUP1 Transcriptional repressor, putative"	"Chassy_YL_A_568"	"YALI1_A14345g"	"YALI0A14542g1_1"	"F2Z6H7"	"uniprot|Q8WZL8 Yarrowia lipolytica YALI0A14542g TUP1 Transcriptional repressor, putative"	""
"c363.a1.a1"	286.862989314103	599.771903481761	484.223704276079	415.146277279148	365.694313538077	286.720774534833	535.408540887094	428.381419260819	17.0944178788542	561.808523448795	296.978704295031	"Chassy_YL_E_1084;YALI1_E27144g;YALI0E22979g1_1;Q6C4X4;similar to uniprot|O13432 Candida albicans FRS1 Phenylalanyl-tRNA synthetase beta chain"	"Chassy_YL_E_1084"	"YALI1_E27144g"	"YALI0E22979g1_1"	"Q6C4X4"	"similar to uniprot|O13432 Candida albicans FRS1 Phenylalanyl-tRNA synthetase beta chain"	""
"c364.a1.a1"	781.762052053239	1201.53226525245	2507.12244573916	1722.13087025313	1081.44820830483	687.341970707959	1199.89005532387	686.053396272969	57.1806050677399	855.792169390431	1232.80702209631	"Chassy_YL_B_349;YALI1_B08885g;YALI0B06831g1_1;Q6CFH9;highly similar to uniprot|O13350 Kluyveromyces lactis ATP synthase D chain, mitochondrial"	"Chassy_YL_B_349"	"YALI1_B08885g"	"YALI0B06831g1_1"	"Q6CFH9"	"highly similar to uniprot|O13350 Kluyveromyces lactis ATP synthase D chain, mitochondrial"	""
"c365.a1.a1"	462.878925230911	924.154031310508	761.020066543115	609.684490447878	582.506037260338	423.221674627518	357.698327847643	529.295914951133	73.725047871662	409.91491192128	548.839866353857	"Chassy_YL_E_1586;YALI1_E39221g;YALI0E33033g1_1;Q6C3Q2;similar to uniprot|Q9C1J4 Pichia pastoris Phosphoribosylamidoimidazole-succinocarboxamide synthase (SAICAR synthetase)"	"Chassy_YL_E_1586"	"YALI1_E39221g"	"YALI0E33033g1_1"	"Q6C3Q2"	"similar to uniprot|Q9C1J4 Pichia pastoris Phosphoribosylamidoimidazole-succinocarboxamide synthase (SAICAR synthetase)"	""
"c366.a1.a1"	3029.06605764314	3556.29419567431	3467.427534226	3406.60646550084	2852.8213288362	3140.9420799743	3225.70258447969	3675.47950480587	1340.30503866239	3475.26596311174	3313.90067063138	"Chassy_YL_E_672;YALI1_E17243g;YALI0E14212g1_1;Q6C5X8;similar to uniprot|Q7SBB3 Neurospora crassa NCU06210.1 predicted protein"	"Chassy_YL_E_672"	"YALI1_E17243g"	"YALI0E14212g1_1"	"Q6C5X8"	"similar to uniprot|Q7SBB3 Neurospora crassa NCU06210.1 predicted protein"	""
"c367.a1.a1"	442.092839677906	721.45543133463	728.86757037163	642.818046455659	537.981838133955	348.323713870359	557.732302594094	498.368993321024	228.085956347364	416.344422439898	606.624672982857	"Chassy_YL_C_465;YALI1_C13355g;YALI0C09636g1_1;Q6CCG2;similar to uniprot|P25605 Saccharomyces cerevisiae YCL009C ILV6 Regulatory subunit of acetolactate synthase, which catalyzes the first step of branched-chain amino acid biosynthesis"	"Chassy_YL_C_465"	"YALI1_C13355g"	"YALI0C09636g1_1"	"Q6CCG2"	"similar to uniprot|P25605 Saccharomyces cerevisiae YCL009C ILV6 Regulatory subunit of acetolactate synthase, which catalyzes the first step of branched-chain amino acid biosynthesis"	""
"c368.a1.a1"	3645.91696411541	4151.2951051668	3956.06974000121	3897.82741934633	4904.40754799826	4518.41135055141	3243.44566801548	4330.67827574154	1970.61644045452	3336.74443392087	4956.24728281154	"Chassy_YL_E_1181;YALI1_E29150g;YALI0E24475g1_1;Q6C4Q8;highly similar to uniprot|P0C2H9 Saccharomyces cerevisiae YLR406C (ohnolog of YDL075W) 60S large subunit ribosomal protein L31B (L34B) (YL28)"	"Chassy_YL_E_1181"	"YALI1_E29150g"	"YALI0E24475g1_1"	"Q6C4Q8"	"highly similar to uniprot|P0C2H9 Saccharomyces cerevisiae YLR406C (ohnolog of YDL075W) 60S large subunit ribosomal protein L31B (L34B) (YL28)"	""
"c369.a1.a1"	499.412450264647	688.44549722585	1833.10390088222	732.316750609308	855.331578872696	481.715879443603	536.419495434028	466.961798432153	64.8673572850995	427.299066419038	1233.05477987309	"Chassy_YL_D_1161;YALI1_D30256g;YALI0D23397g1_1;Q6C823;uniprot|Q6C823 Yarrowia lipolytica YALI0D23397g SDH2 Succinate dehydrogenase"	"Chassy_YL_D_1161"	"YALI1_D30256g"	"YALI0D23397g1_1"	"Q6C823"	"uniprot|Q6C823 Yarrowia lipolytica YALI0D23397g SDH2 Succinate dehydrogenase"	"1.3.5.1"
